user_id,product_id,product_type,review,rating
올립영전메이투,1,스킨/토너,"🫶현직 올영 메이트의 찐 간증 후기🫶

사실 크림 스킨은 좋다는 말은 정말 많이 들었지만 ,,,? 지성 피부라서 굳이 크림이 들어있는 스킨을 써보고 싶은 생각은 안 들었는데? 석진이 사진이 들어가있다? 10년 좋아한 팬으로 안 구매할 수 없잖아요??? 제품력보단 석진이 때문에 구매했는데 웬걸 써보니 지성 피부인데도 속건조 진짜 잘 채워주고 속 수분 잘 채워지니까 수분광이 아주,,, 피부가 매끈해져서 기분이 너무 좋아졌어요 ! 손에 덜어서 쓰는 게 귀찮아서 패드를 위주로 쓰는데 이건 미스트 펌프도 들어가있어 아주 편리하게 사용할 수 있었어요 ! 제품력도 좋고 석진이 사진은 더 좋고 아쥬 ,,, 굿 템 🍀

온라인 행사의 경우는 오늘드림, 픽업으로 구매하면 사은품이 증정되지 않아요 ! > 그 이유는? 픽업이나 오늘드림은 올리브영 오프라인 매장에서 배송이 오는 상품이므로 온라인에서 나가는 증정이나 샘플이 매장에 있지 않거든요 !

결제창에 사은품란에 내가 원하는 증정품이 적혀있나 꼭 보시고 구매하셔야 합니다 🫶

🙇‍♀️🫶 도움이 되셨다면 좋아요 한번씩만 눌러주세용 🫶🙇‍♀️",5
징쎈,1,스킨/토너,"수분감 있는 촉촉한 토너를 원해서 시킨건데
촉촉하긴 한데 넘 기름져요..
양 조절 잘 하시구요.
그리고 미스트 용기(?)로 바꿔서 쓰고 있긴 한데
분사력이 별로라.. 아쉽네요",3
스리쓰,1,스킨/토너,"수부지입니다 가을되니 너무 건조해서 구매했어요
크림스킨이랬는데 딱 발랐을때 그냥 스킨 느낌이었어요 ㅋㅋ 약간 끈적이는거 같긴해도 확실히 속건조도 잡히고 촉촉한거같아요 가을겨울 잘 사용해볼게요 사은품으로 주신 거울이 참 맘에 듭니당 👍",5
데이지33,1,스킨/토너,"사용법 : 미스트로 체인지 할 수 있어서 너무 좋단데요. 사용하기에 무지 편리합니다.

특징 : 촉촉해져요. 저는 2번 미스트해주고 다음 기초로 넘어가요

개선점 : 미스트로 사용할 수 있게 주실 때는 원래 크림스킨 뚜껑 대신 크기가 작거나 얇은 뚜껑으로 보내주심이 어떠실런지요. 미스트로 바꿔끼니 원래 왔던 큰 뚜껑은 그냥 분리수거하게 되던데 조금 아깝더라구요;; 환경까지 생각하는 라네즈가 되었으면 합니다!!",5
스타일러,1,스킨/토너,"✅ 구매목적 / 내돈내산
건조한 겨울철 피부 보습을 위하여 직접 구매했습니다

✅ 장점
크림스킨 보습력이 정말 좋습니다. 겨울 필수템이에요.
향이 거의 없어서 냄새에 민감한 분도 사용 가능해요.

✅ 단점
가격이 비싸졌어요.
옛날 출시 때부터 사용해왔는데 패키지 변경하면서 점점 비싸지네요.
제품 용기 디자인은 갈수록 산으로 갑니다.
미스트는 빡빡하고 뚜껑은 쓸데없이 과하게 커요.

✅ 주의사항
많이 바르면 눈가에 허옇게 끼고 피부 화장 밀립니다.
화장 전에 크림스킨으로 팩 하시면 절대 아니되옵니다..!

✅ 총평
건조하고 추운 겨울철에 피부 보습을 위한다면 라네즈 크림스킨 추천합니다.",3
매일귀여운강아지,1,스킨/토너,"한줄평 : 스킨을 샀는데 덤으로 존잘남 포토카드까지 받고 기분전환 하고 싶으신 분들, 피부타입 상관없이 가볍고 산뜻하고 수분감 많은 기초 찾으시는 분들께 강추합니다!

원래 민감성 극지성이라 스킨케어를 많이 해봤자 토너, 앰플, 크림 이렇게 3단계로만 사용했는데 피부과 치료를 받기 시작하면서부터 얼굴이 건조해져서 수분 많은 미스트를 찾다가 이 상품이 좋대서 구매하게 됐습니다.

상품 설명란에 고보습 토너라고도 써져 있어서 화장솜에다 적셔서 사용해봤는데 다른 물같은 제형의 토너에 비해서는 좀 농도가 짙고 미끌거리는 수분감 많은 텍스처라 토너로 쓰기에는 무거운감이 있습니다.
그래서 같이 온 미스트 뚜껑으로 교체해 사용해봤더니 너무 좋네요!!!

저는 나이트케어로는 닦토한 후에 이 스킨을 미스트로 사용해서 얼굴 정중앙, 양쪽 뺨, 이마 순으로 한번씩 뿌려준 다음 챱챱 흡수시켜 줍니다. 수분이 가득한 스킨 미스트라 한번씩만 뿌려줘도 충분합니다! 그리고 그 다음으로 앰플 써주고 마지막으로 크림을 발라줍니다.

아침에는 화장이 잘 먹어야 하니까 나이트케어보다 훨씬 가볍고 산뜻하게 기초를 발라주는데 원래 토너, 앰플, 로션 혹은 수분감 많고 가벼운 제형의 크림만 쓰다가 앰플 대신 이 미스트를 뿌리고 나서부터 광명찾았습니다.
특히 여름에 원래 하던대로 화장 전 스킨케어를 하면 좀 무겁게 느껴지는 감이 있었는데 이 스킨은 제형이 정말 가벼워서 피부화장을 해도 산뜻하고 가벼워서 기름도 덜 올라오는 느낌이 드네요🥹

제 피부가 좀 예민한 편이라 민감성용, 저자극 기초만 쓰는데요. 이 스킨은 전혀 자극 없이 수분감만 채워주는 느낌이라 아주 맘에 듭니다.

그리고 연예인에 관심이 없어서 누군지 잘 모르지만 모델이 참 잘생겼네요. 신인 배우인가요?
잘생긴 남자 포토카드까지 덤으로 받으니 개안되는 느낌이라 기분이 좋네요 ㅎㅎ
라네즈는 옛날부터 모델을 참 잘 뽑는듯",5
텅수,1,스킨/토너,"[상품 후기]
1. 외관이 고급스럽고 그림감이 좋음
2. 미스트 방식으로도 사용가능
3. 얼굴에 뿌려지는 느낌이 부드럽고 순한 것 같아서 좋음",5
키위새깜자,1,스킨/토너,"가을이 되면서 피부가 급건조해지기 시작해 보습이 될만한 화장품을 찾아보다가 후기가 좋은 라네즈 크림스킨을 구매하게 되었습니다. 수부지 피부라 유분이 적고 수분이 많은 화장품을 쓰는데 그러다보니 오히려 피부가 건조한 느낌이 들더라구요. 원래 쓰던 가벼운 토너 대신 라네즈 크림스킨을 발라줬을뿐인데 보습감이 넘쳐요. 수부지 피부가 가을, 겨울에 쓰기 좋은 것 같아요. 무향이고 성분도 좋아서 마음에 듭니다.",5
코기러버,1,스킨/토너,"최근 환절기로 피부가 크게 뒤집어져서
기존에 쓰던 토너, 토너패드, 앰플 전부 다
뭘 발라도 따갑고 간지럽고 난리도 아니었어요..
아침 저녁으로 장벽크림만 바르다가
아무래도 하나만 바르니까 좀 건조하고 보습이 약해서
환절기템으로 크림스킨을 사봤습니다
이거 진짜 너무 좋네요.....👍🏼 역시 유명한 이유가 있어요
세안후 바로 2~3번 레이어드해서 흡수시키고
바로 크림 바르는데 찬바람 쌩쌩 불어도 끄떡없어요
예전에 다른 크림미스트 썼다가 너무 기름져서 별로였는데
라네즈는 유분감도 적당하고 속건조에 너무 좋고
흡수가 진짜 빨라서 레이어드해서 차곡차곡 쌓으면
피부가 증말 쫀쫀 그 자체
스프레이 뚜껑이 들어있는 게 진짜 최고에요
묽은 타입이라 개인적으로 쫄쫄 흘려서 바르는 것보다
미스트로 뿌리는 게 사용하기도 훨씬 간편하고
흡수도 빠르고 좋습니다
환절기/겨울용 보습 보충용으로 완전 최고👍🏼👍🏼",5
쩡쫑찡,1,스킨/토너,"여름에 항상 쓰던거 입니다!
환절기나 겨울에 쓰기엔 사용 후 시간이 지나면 크림이 필요할 만큼 건조한 느낌이지만,
여름에는 단품만 써도 충분한 정도의 보습정도 입니다
곧 여름 나라로 가게되어 가지고 가려고 주문했숩니다!
저번에 구매할땐 스프레이가 같이 안와서 아쉬웠는데 이번엔 같이와서 사용하기 좋을거 같아요!",5
BTSKOMO,1,스킨/토너,"JIN LANEIGE GLOBAL AMBASSADOR
완전 촉촉 수시로 분사하며 사용합니다
향은 미미해서 향에 민감한 분들께 좋겠어요
휴대하고 싶어서 작은 스프레이 용기도 구입

라벨제거는 쉽게 분리수거 잘 할수있는데
미스트펌프로 사용하면 버려지는
플라스틱 뚜껑이 과한게 좀 아쉽지만 리필 가능
라네즈한 패키지 좋아요",5
yop,1,스킨/토너,여러번 재구매 한 스킨입니다 스킨 중에 가장 보습감이 좋은 것 같아요,5
yop,1,스킨/토너,샤워하자 마자 발라주면 십분은 아무것도 안발라도 될 정도로 보습감이 좋아요,5
본예이,1,스킨/토너,미스트 펌프랑 리필도 준다고 해서 당장 질러버렸습니당! 라네즈 크림스킨 너무 기름지다는 말이 있던데 악건성인 저는 가을겨울 최고의 템이에유,5
비치양,1,스킨/토너,석진이가 광고해서 구입했어요 뭔가 우유스킨같은 느낌이네요 생각보다는 가볍고 순하게 보습되서 좋았어요. 여름에는 복합성이었다가 가을부터 건성피부가 되는데 지금 딱 쓰기 좋아요 만족해요,5
맥주가조와,1,스킨/토너,"몇번이나 재구매 했는지 이제 기억도 안나요. 용기 리뉴얼 되기 전 버전부터 계속 구매해서 사용중입니다! 여름에 쓰기는 개인적으로는 무거운데 어머니는 사계절 내내 잘 쓰셔서 집에 크림스킨 안쓰는 때가 없어요. 찬바람 불기 시작하는 가을에서 건조한 추운 겨울, 답답한 봄 세 계절에 추천합니다. 피부 예민하고 민감한 편인데 쓰면서 트러블이나 불편함 느낀 적 한번도 없었어요. 향은 순하고 크게 안나는 편이지만 개인적으로는 아예 무향이었으면 합니다.",5
쁄,1,스킨/토너,"사실...석삼오라버니 때문에 구매했는데,..너무좋아요...
포토북 말할 것도 없이 흰색 셔츠 느좋...💜 얼굴...
WWH....좋음.....입술..피부.....미남.......
(정신차리고) 일단 같이 동봉되어 온 스프레이 분사형 뚜껑으로 바꾸어서 사용 중인데 나올 때는 진짜 미스트처럼 액체로! 아예 그냥 물처럼 나오거덩여?
근데 이게 막 바르다보면 로션 바르는것처럼 부드럽게 바뀌어요...그렇다고 미끌,찐득 거리는게 아니고 딱 4번 분사했는데 온 얼굴이 촉촉함...일부러 며칠 써보고 리뷰 작성하는건데...너무 좋아효...이게 너무 웃긴게 흡수력도 개쩔어요...왼 뺨 오른 뺨에 각각 뿌려놓고 오른뺨 바르고 나니까 왼 뺨에 뿌려뒀던게 다 흡수됨...
석라버니 아니었으면 이 개꿀제품을 모르고 살뻔..;;
피부도 민감성이라(평소에 썬크림도 제대로 ""못""바름..)동생(역시 아미임) 실험체로 쓰고 손에도 해보고 마침내 얼굴에 사용했는데 너무...좋음....쓰고도 피부 발작 안난게 너무 기특해서 크림스킨 냅다 복복해주고 싶음....원래도 피부 지R쇼 방지 차원에서 여러번의 실험을 거친 뒤 단일제품만 사용했는데(이전에는 스킨 딱 하나만 씀) 이건...미스트도 되고 동시에 크림도 되니깐...아니..라네즈 연구진분들..도대체 뭘 만드신건지....이건..혁명?임,...;;; 개큰 재구매 의사가 생김..... 그리고 구성품 자체가 되게 고급짐,.원래 쓰던건 우리집 고양이가 한 번 떨구고서는 먹통이슈때문에 쓸 때마다 뚜껑 분리후에 털털 털어썼는데...크림스킨은 스무스하게 꾹 꾹 눌림..
리필도 주심... 향은 무향!(동생은 무향인게 너무 좋았대용)
아 그리고 보습 지속력....🤦‍♀️ 시험기간이라 퍼석 피부 개난리쇼 났는데 이게 솔직히 되게 가벼운 제형이라 금방 건조해질 줄 알았는데/ 1시간 후: 음 곧 마르겠군,2시간 후: 음 곧 마르겠군/ 영원히 이것을 반복함..그 끈적하지 않은 보들보들 선 안에서 영원히 마르지 않음...이것 뭐에요 진짜....
이런 개꿀 느좋 제품을 알게 해주신 오라버니께 일단 큰절, 열심히 개발해서 혁명템 개발 해주신 라네즈 연구진 분들께 큰절🙇‍♀️ 그리고 이정도 구성인데 너무 착한 가격이심...
고딩 소녀 용돈 지킴이가되
아 그리고 라네즈의 이 사소한 센스..어쩔거임...!!!
Easy peel이 있음 화장품에!!! 평소에 그렇게 막 환경 지킴이도 내가 다 감동받음..ㅠ
모쪼록 좋은 제품 감사합니다..💜",5
또료니,1,스킨/토너,"아주 촉촉하고
수분감이 좋습니다
스킨만발라도 보습이좋아요
자극없고
끈적이지않고 보들보들
행사때사서 용량도좋고
매우만족 메인 스킨으로써야할듯",5
건조해엄청나,1,스킨/토너,"- 본인 피부
: 20대 중반 / 남성 / 건조한 복합성
T존은 수부지, 면도기가 자주 닿는 U존과 눈가는 악건성, 관리 잘못하면 이마와 관자놀이에 염증성 여드름 생김

- 제품 요약
: 첫 단계부터 피부 수분 보유력을 올려주는 스킨케어 부스터

워터리한 히알루론산 세럼을 아무리 들이부어도 속건조가 해결되지 않으시죠? 유분이 없고 장벽이 무너진 피부는 수분을 머금지 못하기 때문입니다. 바르자마자 물이 증발하는데 속건조가 어떻게 해결되겠어요.

이런 경우 첫 단계에 오일이 들어간 토너로 피부 수분 보유력을 올려준 후 워터리한 세럼을 바르면 속건조 진짜 싹 잡힙니다ㅠ

이 제품엔 메도우폼씨오일과 스쿠알란이 들어있는데요. 둘 다 피부에서 분비되는 피지와 일부 유사한 성분이에요! 때문에 트러블 걱정 없이 첫 단계 보습을 채워주기 좋았습니다!

보습 토너는 밀키한 콧물 제형~젤 제형인 경우가 많은데! 이건 완전 물처럼 묽어요! 오일이 들어간 유화 제형을 이렇게 묽은 토너로 만드는 게 아모레퍼시픽 고유의 제형 기술이라고 합니다! 아무튼 이런 제형 때문에 다음 단계 스킨케어 흡수를 방해하지 않고, 오히려 수분력을 부스팅해주는 느낌이었어요.

또!!
코스알엑스 더 비타민C23 세럼 사용해보신 분들 아실 텐데, 이 세럼 마무리감이 엄청 끈끈해요. 근데 크림스킨 사용 후 이 세럼을 바르니 끈끈함이 없고, 실키하게 마무리돼서 좋았습니다! 비타민C 효과도 더 잘 나는 거 같아요. 전 이것 때문에 계속 재구매할 것 같습니다.",5
무병장수,1,스킨/토너,"상품도 리필도 사은품도 다 괜찮은데 저한테 맞는 제품은
아닌거 같아요,, 확실히 건조하진 않은데 이게 좋은건가,,? 싶은 느낌..?",3
흰뚜루,1,스킨/토너,보습엔 아주 좋아요. 사은품 거울도 너무 이쁘구요.그런데 분사가 별로네요. 시원하게 골고루 분사되지 않아서 여러번 뿌려야 해요 ㅜㅜ,4
RIRI078,1,스킨/토너,"울 엄니 드리려고 구매했어요~//
촉촉하고 좋다고 하새요",5
RIRI078,1,스킨/토너,씰쌀한 날씨에 항상 잘 사용하는 제품. 순하고 좋아요~//,5
RIRI078,1,스킨/토너,기획으로 저렴하게 구매해서 좋아요. 크림스킨은 씰쌀한 날씨에 서용햐뇨,5
이안901,1,스킨/토너,석진이 광고를 보고 정말 안살수가 없었어요 깨끗한 이미지와 정말 찰떡이네요 석진이가 모델하는 동안 제 화장품은 라네즈로 다 바뀔것 같네요,5
수동한,1,스킨/토너,"크림스킨이나 더 촉촉한 기분? 기분탓 일지두요
매번 재구매 하고있어요",4
식물킹,1,스킨/토너,미스트 뚜껑이 같이 와서 너무 좋네요 촉촉하고 부드러워서 사용하고 나면 기분까지 좋아져요,5
dy****,1,스킨/토너,예전에 한번보고 필요해서 구매하였습니다 한달뒤 후기 올리겠습니다,4
모얌당고,1,스킨/토너,"라네즈 크림스킨 그동안 좋다고는 익히 들어서 알고 있었지만, 뭐 잘 못 바르면 좁쌀여드름 왕창 올라오는 수부지(지성에 더 가까운) 여서 여태 못 써봤습니다ㅠㅠ

그러던 중 제 최애가 이번에 라네즈 글로벌 앰버서더가 되었더라구요!? 엇시 포토북도 준대. 결제..결제 갈겨엇..!!!!
하면서 처음으로 크림스킨을 써봤는데.........
라네즈 대체 뭘 만드신겁니까 휴먼?

와 그동안 이걸 고민만 하다 안쓴 시간들이 아까울정도로 완전 인생템 등극입니다ㅠㅠ

일단 제일 걱정했던 헤비한 수분템 사용시 유분폭발이었는데, 크림스킨이 그 부분에 있어서 아주 적절하게 유수분 밸런스을 맞춰준 탓인지 수분충전은 꽉채워주고 유분은 현저히 줄었습니다ㅠㅠ 아침마다 이마에 개기름 인생이었는데 크림스킨 만나고 개기름과 이별했어요 고마워요 라네즈🥹🩵

최근 순하다고 유명한 에스트라 캡슐 어쩌고 수분크림 쌌다가 좁쌀 여드름 가득가득 트러블 잔뜩잔뜩 피부 싹 뒤집혀서 고민이었는데 크림스킨 3일 쓰고 싹 들어갔습니다 진짜.... 미1친거 같아요... 기적을 맛봄...

제 피부 고민들의 원인은 속건조로 인한 트러블과 유분폭발이었나봅니다. 크림스킨이 속건조를 짱짱하게 잡아주니 피부 고민 걱정들이 사악 사라졌어요.

그동안 제품에 대한 편견 때문에 망설였다가 최애가 모델이라기에 단순히 구매 했을 뿐인데 인생 기초템을 만나서 너무 기쁩니다😭💙",5
탄탄고고,1,스킨/토너,김석진 때문에 샀는데..아니 제품이 이리 좋다니~~스킨으로 3번 레이어링하니 마치 에센스 크림 다 바른듯 초크초크하네.화장도 잘먹. 라네즈 하면 김지호가 여인의향기 영화 패러디하던 섹시넘버원 립스틱 광고가 생각나.이 나이에 다시 라네즈에 발 담굴줄이야😂😂😂,5
jk****,1,스킨/토너,모델 진 피부처럼 되길 바라며 🥹💚💙❤️ 제가 써보고 좋아서 선물도 했어요,5
단이00214,1,스킨/토너,"가을이 찾아오면서 다시 찾게되는 크림스킨
미스트로도 토너로도 너무 잘써요",5
젤로,1,스킨/토너,돌고돌아 재구매하는 크림스킨이에요ㅋㅋ 닥토하기도 좋고 미스트용으로 뿌려도 괜찮아요!,5
Lynniee,1,스킨/토너,"역시 JIN-IUS!💜
믿고 쓰는 라네즈와 믿고 쓰는 진의 콜라보라 안 살수가 없었습니다. 포카도 얻고 대용량 리필까지 있는 조합이라 혜자구성입니다.
미스트로 쓸 수 있도록 교체할 수 있는 점도 너무 좋아서 간편하게 수시로 건조할 때마다 뿌릴수 있어서 좋고 환절기에 피부 건조및 진정 모두 잡을 수 있는 순한 제품이라 너무 만족합니다. 배송도 꼼꼼하게 왔고 빨랐습니다.",5
마인,1,스킨/토너,만족스럽습니다 자주 사는 제품 중 하나에요. 후기보니까 왜 인기 많은지 알겠드라구요! 좋은 제품 자주 구매할 수 있게 이벤트도 많이 해주세요! 정말 후회 없는 상품입니당 잘 쓰더록 할게요! 주변 지인들두 너도나도 구매한다고 합니다 해피해피,5
뷰티플데이,1,스킨/토너,"라네즈크림스킨 케이스병이 너무 세련된것 같고 안에 있는 내용 물도 너무좋아요☺️
왜 국민스킨이라 불리는지 사용하고나면 알수있는것 같아요 정말 맑은 스킨에 수분크림을 섞어놓은듯한 우유같은 스킨인것 같아요
우유빛 색깔인 라네즈 크림스킨은 수분크림 한통을 토너에 다 넣은것 같아요
라네즈 수분드뿍 크림스킨은 피부에 잘 스며들고 장시간동안 촉촉한 수분감을 유지시켜주는것 같아요👌🏻
그리고수분감을 정말 많이 주는 토너 인것 같아요
어느계절이나 어떤피부타입에도 상관없이 적합할것 같아요 저는 미스트대신에 피부가 건조해질때 미스트병 용기에 담아서 수 시로 얼굴에 분사해요 좋 그럴때마다 건조해졌던 제피부가 금새 탄력있어지는것 같아요
국민스킨 라네즈크림스킨 적극 추천합니다👍🏻",5
뷰티플데이,1,스킨/토너,"라네즈크림스킨 케이스병이 너무 세련된것 같아요
안에 있는 내용 물도 너무좋죠
왜 국민스킨이라 불리는지 사용하고나면 알수있는것 같아요 정말 맑은 스킨에 수분크림을 섞어놓은듯한 우유같은 스킨인것 같 아요
미세먼지와 코로나로 마스크를 장시간 사용하면 피부가 건조해지고 많은 수분감과 탄력감이 떨어져 속상했어요우유빛을 띄는 라네즈 크림 스킨은 수분 크림 한통을 토너에 다 넣은것 같아요 라네즈 수분드뿍 크림스킨은 피부에 잘 스며들고 장시간동안 촉촉 한 수분감을 유지시켜주는것 같아요수분감을 정말 많이 주는 토너 인것 같아요
어느계절이나 어떤피부타입에도 상관없이 적합할것 같아요 저는 미스트대신에 피부가 건조해질때 미스트병 용기에 담아서 수 시로 얼굴에 분사해요
해 그럴때마다 건조해졌던 제피부가 금새
탄력있어지는것 같아요
국민스킨 라네즈크림스킨 적극 추천합니다
도움이 되셨다면 버튼 한번 꾸욱 부탁드리겠습니다!🙇🏻‍♀️💗",5
OliviaSpanish,1,스킨/토너,진이 광고해서 인스타 광고보고 홀린듯이 결제했어요 포카북에 진 사진 네 장이나 있는데 너무 예뻐요 170ml가 본품인데 거의 본품만큼 130ml 리필 줘서 놀랐고 미스트 펌프를 같이 주는데 오자마자 바꿔서 미스트로 써봤는데 분사도 잘되고 아침에 일어나니 촉촉하고 너무 좋아요 무슨 샘플도 잔뜩 들어있었는데 좋아요 우리 진이 광고해서 산거지만 제품이 좋네요 올리브영 매장에서 사면 포카북도 없고 리필도 50ml인가 쪼끔 주고 미스트 펌프도 다른 샘플도 없는것 같던데 진이 덕분에 좋은 제품 사고 선물도 잔뜩 받았네요 감사합니다 크림이 토너에 섞인 느낌인데 둥둥 뜨지도 않고 자극적이지도 않고 향도 좋고 매우 촉촉하고 미스트로 뿌리니 편하고 좋아요 최곱니다 강추합니다,5
이수아아,1,스킨/토너,"겨울마다 사용하는 제품인데 미니 포토북이 갖고싶어 이번엔 좀 빨리 구매해봤습니다. 제가 피부장벽이 무너진 상태인데 지금 피부가 나아진데에는 이 크림 스킨을 수시로 발라주고 보습해준 효과라고 생각합니다ㅠㅠ 몇번을 레이어링을 해주면 전혀 건조하거나 땡기지가 않아요! 흐르는 물 제형인데 보습감이 진짜 짱입니다.찐 추천템입니다.
(그리고 미니 포토북 너무 좋아요💜)",5
미니골드,1,스킨/토너,예전부터 좋다는건 알고있었는데 가격대가 있어서 망설이다 구매를 안했었는데 세일해서 거울도주고 미스트 펌프도주고 리필추가도 있어서 바로구매했어요~배송도 하루만에 도착해서 좋았어요 재구매 추천이요,5
밤송,1,스킨/토너,추워지는 계절이면 어김없이 쟁여둡니다 이만큼 보습력 좋은 스킨 없는 것 같어요,5
띠링띠링띠로링,1,스킨/토너,"사계절 내내 사용 가능한 제품이어서
항상 사용하는 크림스킨입니다!
보습력도 좋아서 만족하면서 사용하고있어요",5
쿠키토끼,1,스킨/토너,되게 우유 같은 느낌의 제형이고 보습력이 좋아요. 그리고 미스트 분무기도 주셔서 간편하게 뿌릴 수 있어서 좋아요,5
susu70,1,스킨/토너,"석진이 때문에 샀는데 스킨 너무 좋아요 보습도
너무 잘되고 미끌거리는것도 없고 너무 좋네요
다써도 또 사서 쓰고싶을만큼 좋아요 대만족입니다",5
뽀이동이,1,스킨/토너,건성에 좋아요 만족합니다 자극없이 순하고 좋아요 미스트 분사기 도 좋네여,5
별향,1,스킨/토너,"라네즈 크림스킨 소문처럼 촉촉하네요
건성 겨울용 스킨으로 굿..굿..",5
히플이,1,스킨/토너,"라네즈 크림스킨 한번에 되있는거 좋아서 구매하고 계속 사용중이였는데
생각도 못한 김석진이 있어서 어차피 구매해서 쟁겨놓으면 쓸거니까 과소비좀 했숨돠
히힛 알찬 과소비 쵝오",5
투벨실버,1,스킨/토너,"크림스킨인데 분사력도 짱좋고 막 뿌려주기 좋아요!
피부에 아주 최적합한 제품입니답
석진이 포토북 받는김에 샀는데 사길 넘 잘한거같아요🥹
양도 생각보다 많아서 좋아요>.<",5
요가파이어,1,스킨/토너,이거 첨 구매하고 이런 제품이 있는지도 모르고 광고 보고 알았어요. 리뷰가 좋아 한번 구매해봐요. 근데 리뷰가 다 아미들인가요? ㅋㅋㅋ 진 때문에 샀나? ㅋㅋ 여튼 받아보고 용기가 넘 귀엽고 특이했어요. 스킨 색도 우유 같은 느낌이네요. 저는 분사 펌프로 바꿔써볼려고해요. 자극 없이 순해요.,5
