user_id,product_id,product_type,review,rating
저주인형ㅡ올리브,11,스킨/토너,"사은품으로 받은 수분 크림은 몇달 전에 원 플러스 원인 거
사서 잘 쓰고 있는데, 소용량이라 가지고 다니면서
여행 가거나 친척집 가거나 야근할 때 사용할 수 있으니
편하고 좋다.
ㅌㄹㄷ 토너 몇 병 잘 쓰고 있는데, 다 써가는 참에
요즘 수분 충전이 잘 안 되는 느낌이라
에스네이처도 평이 좋고 성분이 비슷한 거 같길래 사봤다.
겉이든 속이든 건조함을 완전히 잡아주지는 못 하지만,
가격이 저렴하고 양이 많으니까 두세 번 덧바르고 두드려주면
속건조도 많이 잡혀서 좋다.",5
drdk0206,11,스킨/토너,레이어링해서 피부에 쌓기 좋고 촉촉하니 아주 좋아요!!!!!,5
생일축하해,11,스킨/토너,순하게 사용하기 좋아요 촐촉해요 무향이라 좋아여 끈적이지않어요,5
콩잉2,11,스킨/토너,화장이 계속 떠서 검색하다 수부지 토너로 추천받아서 구매했는데 만족해용,5
핑크다연,11,스킨/토너,늘 사용하는 제품이에요 요즘짙은 환절기에 사용하기 더 좋음,5
씩씩한부엉이,11,스킨/토너,완전 물은 아니라 데일리용으로는 안쓰고 주기적으로써요! 가을겨울에 더 좋을거 같아요!,5
사막의별,11,스킨/토너,"조카 선물했는데요 조카 말로는 엄청 순하다하더라구요 최대한 조카에게 묻고 후기 남깁니다

@향/무향

@재형/물타입

@자극/없음

@발림성/깔끔하게 발림

@끈적임/없음

@사용후/깔끔하고 뭐 안바른듯 깔끔닥토됨 조카가 홍조도 있고 뺨에 좁쌀여드름도 좀 있는데 이거쓴후 많이 완화되보임

@순하고 깔끔한 스킨 찾는분께 제격임",5
복합건성건성녀,11,스킨/토너,"복합성들에게는 잘 맞을꺼 같아요 다만 가을 겨울은 비추에요 봄.여름에 쓰기 가벼운 스킨계열이고 눈에 들어가면 많이 따가워요,, 눈에 안들어가게 쓰면 좋을꺼 같고 닦토로 추천합니당 보습이 있거나 수분감을 채워준다까지는 아닌데 땡김은 덜해서 좋아용",4
밸링엄,11,스킨/토너,"에스네이처 스킨 너무 좋아요
대용량이여서 부담없이 사용하기에도 좋구요
가볍게 만족하며 사용할수 있어서 넘 만족합니다
촉촉하고 밀착감도 너무 좋아요",5
가나다래,11,스킨/토너,막 쓰기 좋은 물토너입니다. 완전 물토너처럼 물기가 날아가며 더 건조해지는 느낌은 아니에요. 약간 보습 느낌은 있는듯요.,3
쿠바나,11,스킨/토너,"무난~합니다
딱히 나쁜 것도 아니고 그렇다고 엄청 좋은 것도 아닌...
재구매는 좀 고민해봐야 할듯...",3
glluck,11,스킨/토너,"토너는 물까진 아니고 그렇다고 콧물도 아닌 제형? 저는 두 번 정도 레이어링 해서 발라주는데 보습감 충분해요. 근데 대단히 진정되는 그런건 아님요.. 그냥 무난
크림은 생각보다 기름지고 얼굴에 열이 올라서 열감 많은 사람은 피하는게 좋을 거 같아요. 저는 트러블 올라와서 바로 사용 중지함..",3
ramina****,11,스킨/토너,순하게 PHA 제거 기능이 있으니... 토너를 사용한 동시에 아주 좋아요... 저녁에 사용하기 아주 좋아서 애용하겠습니다! >_<,5
yhy****,11,스킨/토너,무난하게 사용하기 괜찮아요. 젤크림도 같이 와서 더 좋아요,4
tjfals****,11,스킨/토너,무난한 스킨케어 제품으로 탑인 제품인 것 같아요! 가격도 좋고 최고입니다~,5
zzoo****,11,스킨/토너,"이 스킨은 몇통을 쓰는지 모르겠어요
에스네이처 입문템이구요
이후로 수분크림 클렌징오일 폼 선크림까지 구입해서 쓰고 있어요
건성에 좋고 촉촉하고 자극이 없어서 너무 좋아요
씻자마자 촵촵 발라줘야 마음이 편안합니다",5
jwo****,11,스킨/토너,남자친구가 피부가 예민해서 엄청엄청 순한걸 써야하는데 이것만 쓰네여 좋아요~,5
수낵,11,스킨/토너,민감성 수부지인데 뾰루지가 너무 많이 올라와서 진정만 해주다가 각질정리를 해야한다는 말을 듣고 파하로 시작해보려고 구매했어요. 저녁엔 닦토 아침엔 찹토로 세 번씩 레이어링 해주니까 보습감도 충분하고 피부결 정리도 많이 됐어요! 쟁여두고 쓰려고 해요. 대용량인 게 진짜 좋아요,5
금빛하늘,11,스킨/토너,"셀프패드와 같이 구매해서, 토너 패드로 사용하고 있어요.
무난하게 데일리로 사용하기 너무 좋아서 손이 정말 자주 가는 것 같아요! 성분을 자세히 따져주시는 유튜버 추천 제품이라, 더 믿고 사용하는 제품입니다!
다 사용하면 또 구매할 것 같아요.",5
아야어여오유우유으이,11,스킨/토너,세안하고 나서 가볍게 피부결 정돈하는데 사용하기 좋아요. 부드럽고 순해서 피부에 부담감도 없어요,5
나너좋아하냥,11,스킨/토너,"민감성 피부에 자극 없이 쓸 수 있어 좋음
여러번 챱챱 두드려 바른 후 수분크림 바르는 중",5
ppjh****,11,스킨/토너,기존에 사용하고 있던 제품이여서 할인하는김에 구매했어요 무난하니 좋아요,5
qkrtjsfu****,11,스킨/토너,유명하대서 써봤는데 순하고 보습감이 좋아요 완전 물 제형이에요,5
yund****,11,스킨/토너,무난하게 사용하지 좋을 거 같아서 구매했습니다 더 써봐야 알 거 같아용,5
leauken****,11,스킨/토너,"토너정착템입니다 에스네이처토너 꼭 써보세요 닦토하고 토너 찹찹 한번 더 발라주면 촉촉피부환생이에요
같이주는 수분크림도 화장잘먹 크림추천 완전요",5
윤꼬미,11,스킨/토너,"⭐️내돈내산 한달리뷰입니다⭐️
화해 1위라고 해서 구매했는데 막 좋지도 안 좋지도않네요~ 무향에 끈적거리지않지만 세일안하면 안살것같아요. 제품은 우수하지만 제취향이 아니라 별하나 뺏어여",4
피스타치오오,11,스킨/토너,무향에 자극이 없어서 무난하게 사용하기 좋은 제품입니다 양도 많아서 좋아요,5
sahala****,11,스킨/토너,"토너가 떨어져서 급하게 눈에 보이는 것, 개중에 싼 것들 중 이걸 골랐는데 진짜 괜찮음.. 화장도 잘 먹고 가을이면 냅다 뒤집어지던 내 피부가 지금까지 잘 견디고 있음.. 전에 쓰던 토너는 촉촉하지만 봄이나 가을에 서서히 뒤집어졌는데 이건 아님.. 같이 온 크림도 화잘먹임 그냥.

완전 겨울엔 크림이 버텨주지 못할 것 같다는 게 슬픔 ㅠㅠ 그래도 이 토너 + 달팽이크림으로 유수분 밸런스 맞춰주기만 하면 겨울도 잘 보낼 수 있을 듯!!

정말 만족한 제품. 재구매 의사 만땅!",5
Zz,11,스킨/토너,"디파님 유튜브보고 구매했어요!
용량도 크고 할인하니까 금액도 괜찮네요!!",5
짱짱한쿵잔치,11,스킨/토너,자극없고 향이 없어 편안하게 쓰기 좋아요🙃 닦토를 해도 수분 충전이 잘 되는 느낌이라 만족스러워요!,5
제뜨,11,스킨/토너,토너 제형이며 흡수력이며 보습이며 다 마음에 들어요 수분 충전 제대로입니다,5
YoungLifee,11,스킨/토너,"극건성친구 쓰라고 사줬는데 무향이고, 물토너보단 진짜 쬐금 점성이 있어요

무난하고 저는 갠적으로 토너보다는 증정으로 주신 수분크림이 더 좋았어요",4
또또잉z,11,스킨/토너,촉촉하고 수분감 있어서 기본으로 사용하기 좋아요 자극적이지않고 순합니다,4
녜징,11,스킨/토너,닦토하려고 산 토너인데 진짜 좋네용 너무 물제형도 아니라서 보습감도 채워지는거 같아요,5
코기몽자,11,스킨/토너,토너로 속보습 채우는 편인데 이 제품도 나쁘지 않아서 무난하게 쓰기 좋은 것 같아요.,5
쿠바나,11,스킨/토너,"애매함
아쿠아 라인 중에 젤 애매한 제품 같아요
수분크림이랑 토너패드는 잘 써서 이것도 괜찮을 줄 알았는데
걍 그저 그래요 재구매는 안할듯",4
뜨리야,11,스킨/토너,자극없이 좋고 보습두 넘 좋아요 ! 모든 피부에 잘 맞고 예민피부분들도 걱정 없이 쓸 수 있을 거 같아요!!,5
정그래,11,스킨/토너,수분감이 좋네요 발림성도 좋고 쫀쫀하니 탱글해지는 기분이 들어요.,5
지쥬니,11,스킨/토너,완전 순하고 보습 괜찮은 물토너에용 저는 1/2 화장솜에 묻혀서 쓰고있는데 굳굳,5
sun3057****,11,스킨/토너,"자극없이 순해서 여러번 발라도 괜찮고 맘에들어요
잘 사용하고 있습니다",5
sss****,11,스킨/토너,"두번째 구매 아주 만족하면서 잘쓰고 있어요 자극없고 보습력도 만족하면서 사용하고있습니다 당분간은
이제품만 계속 쓸거같아요 아주만족이요",5
hyn****,11,스킨/토너,순하고 수분만 가득 주는 것 같아 좋아요. 환절기라 피브 난리났어서 수분라인으로 싹 바꿔주었거든요. 너무 가볍지도 않고 적당한 묵직함이 있어 좋습니다. 수분라인으로 재구매의사 있어요.,5
nalss****,11,스킨/토너,"순하고 물같은 제형이라 닥토로 쓰기 좋은데
용량이 생각보다 작아서 아쉬워요~",4
sophia1****,11,스킨/토너,원래세통연속썼다가 토리든으로갈아탔는데 추워지고 각질오돌토돌 올라오는게 느껴져서 바꿨어요 하루만써도 다음날 맨들해지고 화장잘먹는느낌들어서 좋음ㅎ,5
cindy****,11,스킨/토너,"그냥 무난하고 순한 토너 찾으시면 사라고 강추합니다!!!😄
피부결에 맞게 토너로 결 정리해주시면 최고에요!!! 그리고 약간의 점성도 있어서 생각보다 깔끔한 토너에요!",5
tt****,11,스킨/토너,아침 세안후 꼭 사용합니다 제형이 묽어서 피부에 잘 흡수되고 피부결 정돈이 잘되네요 같이 온 수분쿠림은 제형이 생각보다 무거워서 겨울에 사용해면 좋을거 같아요,5
방구링,11,스킨/토너,여름철에 잘 사용한 에스네이처 토너 건성이라서 겨울이라 토너를 바꿔야하지만 정말 가끔씩 사용해볼 예정! 물 제형으로 순하고 저는 미스트공병에다 뿌려서 두 번 정도 레이어링해서 사용하니까 좋더라구용 촉촉 그잡채,5
아기공룡르디,11,스킨/토너,용량도 적당하구 기획세트라 좋아요 가격도 저렴하구 촉촉하고 순해요!,5
DGHP,11,스킨/토너,무난무난 수분 가득한 토너입니다 추천받아 샀는데 만족스러워요,5
뱅이,11,스킨/토너,"매장에서 소개받아서 사용해보고 좋아서 구매했습니다
맘에듭니다.",5
luckygood,11,스킨/토너,짱 좋습니다 여러번 사서 쓰고 있네요 ㅎㅎ 제형도 좋고 보습에 참 좋습니다,5
리뷰요정정,11,스킨/토너,원래 다른 거 사려다 모르고 이거 샀는데 너무 좋아요!!피부 속건조 잡기 좋아요,5
안냥냥이,11,스킨/토너,"보습에
좋고 수분이 충전이 되는 토너! 수분 충전에 좋아요~~",5
osmcm4****,11,스킨/토너,무난무난한 토너에요 흡수시켜서 사용하기도 하고 닦토로 쓰기도 하는데 무난해요!!,4
shj0****,11,스킨/토너,"진짜 레전드... 저 좋다는 토너 다 써봤는데 이렇게 세럼 같이 촉촉하고 잘 흡수되는 토너 처음인 것 같아요..
전 오히려 남자친구가 요즘 에스네이처 화장품으로 다 바꿔봤는데 너무 좋더라 추천 받아서 이번에 토너랑 밀착 크림으로 바꿔봤거든요!
진짜 둘이 같이 사용하면 더 촉촉하고 피부결이 좋아지는 느낌을 받았습니다.

제 피부는 건성이고 한번도 여드름 난 적 없는 피부인데
이마에 왁싱을 잘못해서 20대 후반 성인 여드름을 겪고 있습니다.
그래서 굉장히 예민하고 두드러기성 여드름, 화농성 여드름으로 폭탄이 됐어요 ㅠㅠ
근데 에스네이처로 다 바꾼 후 가렵거나 여드름이 더 올라오거나 하는게 없어서 와~ 이거 요물이다 하면서 사용하고 있어요!!",5
yannol****,11,스킨/토너,"데일리 각질+유수분케어로 딱인 기본토너예요
아침저녁으로 매일 쓰는 토너입니당
다만 각질성분이 있어서 때로는 자극적일 수 있습니다
(전날 레티놀 사용 등)

토너라고 마냥 물만 있는 게 아니구
각질+수분케어가 다 되니까 딱 좋아요
화장한 날 클렌징하고 피부정돈하는 용도로도 좋은 것 같아요

피부자극 없이 각질을 제거하면서도 충분한 수분이 공급되어서
요 아이가 독도토너보다 각질+수분 두 가지 면에서 모두 더 훌륭하다고 생각해요

전 매일 흡토+레티놀 또는 비타민+주 1~2회 모공팩 루틴이 되면서
각질제거를 따로 안 하고 있고, 안해도 충분히 피부결이랑 모공관리가 되고 있어요

화장을 급하게 수정할 때도 얘만한 친구가 없어요
화장솜에 토너 충분히 적시면 피부 빨개지는 일도 없이
오히려 수분을 더 충전하면서 편안해지는 걸 느껴요

쪼금 비싼 느낌은 있는데 탑티어 토너라 생각합니다 왕추천",3
congn****,11,스킨/토너,"어떤겁나피부좋은유튜버가쓰길래홀린듯이사봤는데순하고좋긴한데엄청촉촉한지는모르겠어요
물처럼줄줄흐르는제형이에요 화장할때기초로밀리지않게더없이좋은것같아요 자극없는향에작은수분크분까지세트로써보니더좋네용",5
lgseo****,11,스킨/토너,"유튜브에서 보고 예전부터 사고 싶었던 토너인데 크림 2개 세트인걸로 살까 아님 토너+미니크림 기획으로 살까 고민하다가 이 기획으로 구매했어요!

일단 저는 얼굴에 열이 정말 많은 용암맨입니다! 그런데 얼굴을 세안하고 나와서 이 토너를 찹찹 흡수 시켜주는데 어머나 세상에!!!!! 즉각적으로 얼굴이 시원해지는게 느껴져서 정말 깜짝 놀랐어요! 그렇게 쿨링감이 오래가진 않겠지 생각했는데 꽤 오래가서 오랜만에 시원한 얼굴을 만져봤어요!

제가 향에 예민한데 무향에 가까워요! 제형은 진짜로 그냥 물 제형인데 바르다보면 손에 약간 기름기가 느껴져서 흠칫했는데 막상 거울을 보면 기름기가 느껴지지 않습니다!

또 조금이라도 계절이 바뀌면 얼굴에 각질이 뿅 하고 인사하는 타입인데 각질도 잘 잠재워주는 기분이예요! 일단 사길 잘했다는 생각이 드네요!🩷

재구매 의사 있습니다!",5
혀니02,11,스킨/토너,"무향에 막 쓰기좋아요
건성피부인데 겨울에는 못쓸거같아요~~",5
BUBBLELY,11,스킨/토너,좋아요 수분감도 좋고 기초는 뭐가 나지않는 것으로 반은 먹고 들어가는.제품이라고 생각해서 앞으로도 계속 쓸 것 같아요,5
Sarah,11,스킨/토너,무향에 자극없이 순해서 민감성 피부인데 잘 쓰고 있어요 ㅎㅎ,5
긍rlo,11,스킨/토너,물토너인데도 불구하고 약간 기름집니다. 비추해요 다른 제품 추천합니다,5
라푼젤리,11,스킨/토너,"에스네이처 유명해지기 전부터 수분크림 잘 써온
브랜드인데 이번엔 토너를 구입해 봤어요
수부지라 항상 각질제거 토너로 스킨케어 시작하는데
마침 사용하던 각질제거 토너 다 써가길래 이걸로 사봄
확실히 각질토너를 써야 피부가 매끄럽고
그 다음 스킨케어도 찹찹 잘 먹어요!!
물처럼 가벼워서 레이어링 하기도 좋은 제형입니다
여름에 아주 딱이네요
저의 꿀팁은 스프레이 공병에 토너 담아서
세안 후 물기가 덜 말랐을때 미스트처럼 토너 뿌려줘요
그리고 흡수 시키기!
닥토는 가끔 피지정리 해볼까 하는날에 해줘요!
매일하면 피부에 오히려 자극이 가요ㅠ
화장솜에 토너 적셔서 토너팩으로 써도 좋을 것 같아요!!
그리고 증정 수분크림 여행용으로 너무 찰떡콩떡><
잘 썼던 수분크림이라 증정 받아 좋아요
유수분 밸런스가 적당해서 여름철 수부지에 딱이거든요",5
맴두,11,스킨/토너,"에스네이처 크림을 예전에 써보고
그냥저냥.. 느낌이라 그 후로 관심이
없다가 토너가 좋다는 얘기를 많이
들어서 구매해봤어요 :)

일단 스킨팩으로 쓰는 걸 좋아하는데
올리자마자 쿨링감이 좋아서
피부 열감 내리기 좋겠다는 생각이
가장 먼저 들었어요 !

완전 물 제형의 토너라 수분감은
좀 덜하겠다 싶었는데 생각보다
피부 속 건조를 잘 잡아주는 거 같아요

일단 가장 좋았던 건 스킨팩 후
피부가 메이크업 잘 먹는 피부의
상태로 만들어 주더라구요 ㅎㅎ

할인할 때 구매해서 저렴하게
잘 구매한 거 같아요 !",5
핫걸올챙이,11,스킨/토너,"갑자기 요철이 폭발하면서 매일 팩토로 관리하니까
요철이 진정되면서 피지분비도 많이 줄어들더라구요

가볍고 산뜻한 제형의 물 토너에요
닦토,찹토,팩토로 활용가능한 만능이에요

EWG그린등급으로 민감한 피부에도 순하게
사용할 수 있어요

PHA 성분이 있어서 자극없이 묵은 각질과 피지를 제거해줘서 화장하기 전 닦토로 사용하면 화장이 잘 먹어요

세안 후 피부결 따라 닦토를 해주면 속부터 촘촘하게 수분이 채워지고 끈적임 없이 산뜻하게 마무리 돼서 각질관리는 물론 수분, 진정까지 함께 관리 할 수 있어사 더욱 좋아요

함께 주는 크림도 평소에 쓰고 있는 제품인데 작은 사이즈로 나와서 여행다닐때 가지고 다니기 좋더라구요

제 글이 도움이 되셨다면 👇🏻 아래에 도움이 됐어요 엄지버튼 꾹 눌러주시면 감사하겠습니다..🫶🏻",5
궁금한건못참아요,11,스킨/토너,"수부지+트러블 피부 리뷰어의 후기🙂

️️☑️ 수분 챙겨주기😊

얼굴에 열감이 많고 수부지 피부라서, 기초단계에서 충분한 수분공급+열감식히기가 중요한데요!

이 제품은 촉촉하지만 가볍게 흡수되는 제형이라,
건조한 정도에 따라서 여러번 레이어드해줘도, 촉촉+쫀쫀하지만 산뜻한 마무리감이라 잘 쓰고 있습니다🥰
화장하기전에 사용해도 밀림없어서 좋아요!



조금이나마 도움이 되셨다면
도움이돼요👍🏻 부탁드립니다🙇🏻‍♀️",5
달보드레16,11,스킨/토너,"에스네이처 토너
디바이스 사용시 무겁게 바르기 부담
스러워서 토너 샀어요. 지성이고 완전
물토너 원해서 찾다가 구매해 봤는데
순하고 괜찮은거 같습니다.

스프레이 용기 사다가 덜어서 사용중
인데 편리하고 사실 이거 하나만
사용하고 메컵도 가능합니다.
촉촉한거 같아요ㅎㅎㅎ",4
무등산토종올챙이,11,스킨/토너,"자극없이 순하면서 어떤 스킨보다 촉촉하고 오래 유지되고 보습에도 좋지만 진정에도 좋은 스킨같아요
제피부에는 히아루론산이들어간 더랩 ㅇㅇㅇㅇㅇ보다는 좋고 아ㅇ브 도 좋은데 훨씬더 촉촉함이 오래가서 각질이 안일어나는거 같아요 강추!",5
핫걸올챙이,11,스킨/토너,"화잘먹 토너로 유명해서 구매해봤어요

가볍고 산뜻한 제형의 물 토너에요
닦토,찹토,팩토로 활용가능한 만능이에요

EWG그린등급으로 민감한 피부에도 순하게
사용할 수 있어요

PHA 성분이 있어서 자극없이 묵은 각질과 피지를 제거해줘서 화장하기 전 닦토로 사용하면 화장이 잘 먹어요

세안 후 피부결 따라 닦토를 해주면 속부터 촘촘하게 수분이 채워지고 끈적임 없이 산뜻하게 마무리 돼서 각질관리는 물론 수분, 진정까지 함께 관리 할 수 있어사 더욱 좋아요

함께 주는 크림도 평소에 쓰고 있는 제품인데 작은 사이즈로 나와서 여행다닐때 가지고 다니기 좋더라구요

제 글이 도움이 되셨다면 👇🏻 아래에 도움이 됐어요 엄지버튼 꾹 눌러주시면 감사하겠습니다..🫶🏻",5
무등산토종올챙이,11,스킨/토너,모든 피부에 잘 맞고 촉촉하고 잘스며들어서 수분유지가 잘되요 다른 수분력 강한 스킨들보다 제가느끼기엔 아주 오래유지됨니다 그래서 각질도안생기고 겨울에도 괜찮앗어요 라방하는지 모르고 먼저 구매해서 선물로 줫는데 다들 사용해보면 빠지게되요 신기한 제품임니다,5
무등산토종올챙이,11,스킨/토너,향도없지만 정말촉촉하고 순하고 민감한 수부지에게도 잘 맞지만 모든피부에 두루맞아서 선물하기에도 넘좋아서 요즘 계속 사날으고 라방보고 쟁이게되네요 유수분발란스 잘맞춰서 크림과 함께 사용하면 피지분비도 덜하고 뾰루지도 안나요 신기한 에스네이처 제품이예요~^^,5
무등산토종올챙이,11,스킨/토너,디렉터파이 착한박스에 들어잇엇는데 써보고 너무 좋아서 구매함니다 그러고보니 스킨과 크림을 모두 에스네이처로 사용하고잇네요 물토같은데 다른 수분물토랑 다르게 촉촉하고 오래가요 겨울내내 각질없이 정말 잘 사용해서 하난 쟁여놈니다. 민감 수분부족인 제피부에 딱맞는 제품을 찾아서 아주 만족하며 사용하고잇어요,5
핫걸올챙이,11,스킨/토너,"화잘먹 토너로 유명해서 구매해봤어요

가볍고 산뜻한 제형의 물 토너에요
닦토,찹토,팩토로 활용가능한 만능이에요

EWG그린등급으로 민감한 피부에도 순하게
사용할 수 있어요

PHA 성분이 있어서 자극없이 묵은 각질과 피지를 제거해줘서 화장하기 전 닦토로 사용하면 화장이 잘 먹어요

세안 후 피부결 따라 닦토를 해주면 속부터 촘촘하게 수분이 채워지고 끈적임 없이 산뜻하게 마무리 돼서 각질관리는 물론 수분, 진정까지 함께 관리 할 수 있어사 더욱 좋아요

제 글이 도움이 되셨다면 👇🏻 아래에 도움이 됐어요 엄지버튼 꾹 눌러주시면 감사하겠습니다..🫶🏻",5
빵먹고싶은사람,11,스킨/토너,"같은 회사 제품들을 사면서 함께 구매한 ~ 💦





📍가벼운 물타입 토너예요
약간 미끈거리긴하는데 보통 다 그러니까 머 ㅎ ㅎ
여러번 덧발라도 찐득거리지 않아서 좋아요
외출 전에 피부를 촉촉하게 만들 수 있음






📍속건조 해결 토너라는 후기가 많던데 어느정도는 맞는말같아요 !! 이런 물타입 토너는 여러번 덧바를수록 수분 급속충전을 시켜주기땜에

근데 다른 분들 말처럼 엄청난 효과가 있진 않았어요
정말 딱 기본 수분토너? ㅋㅋ 근데 기본이 젤 중요하니까 머
양도 생각보다 많아요 팍팍 써도 된다는 점이 좋았음






💥총평 : 크게 신경쓰지 않고 몇번씩 덧바를 물 토너가 필요하다면 추천합니당
다만 정말 수분에만 초점을 맞춰서 진정 효과는 없어요
진정효과까지 원하시면 넘버즈인 청초토너나 헤이네이처 어성초 토너 추천 .. 저는 에스네이처 토너까지 물토너 중에는 이 세 개를 제일 마니 쓰는 것 같네요",5
궁금한건못참아요,11,스킨/토너,"수부지+트러블 피부 리뷰어의 후기🙂

️️☑️ 추천템으로 구매✨

에스네이처 기초템이 수부지 피부에 좋다는 추천이 정말 많더라구요!
그래서 기초 라인 조합을 함께 구매해서 사용 중입니다😊

개인적으로 저는 속건조가 느껴지고, 얼굴에 열감이 느껴지는 수부지 피부입니다🥲

메이크업 전에 가볍게 토너팩으로 열감도 빼주고, 수분감도 충전해주고 시작하고 있습니다!
토너팩만 해도 쫀쫀한 느낌이 들어서 다음 제품 흡수도 잘 되는 것 같아요!

추가로,
메이크업 후에는 완-전- 물 제형의 미스트를 뿌리기도하지만, 이 제품을 미스트병에 넣어서 미스트 대용으로 사용하기도 합니다!
수시로 속건조 잡아주기 좋아요🙂
가볍지만 쫀쫀하게 잡아주거든요!


조금이나마 도움이 되셨다면
도움이돼요👍🏻 부탁드립니다🙇🏻‍♀️",5
룐사마,11,스킨/토너,"스킨케어 유목민 에스네이처로 정착했어요🩵

순서대로 비포 애프터인데 솔직히 말 다했죠?!
애프터 피부 사진도 완전 꿀피부까진 아니지만
제 기준 많이 좋아졌다고 봅니다 흑흑흑😭

사계절 내내 잘 사용하고 있는 에스네이처 스쿠알란세럼
토너부터 세럼, 크림까지 싹 에스네이처로 바꾸고
피부 광명 찾았습니다요,,, 민감성 복합성 피부라
안맞으면 바로 트러블 올라오는데 아주 순해서 잘맞아요

다른 화장품이랑도 궁합이 좋아서 같이 발라도
밀리지 않아서 좋더라구요 성분도 좋아서 앞으로도 쭉~~~애용할듯 싶어요😍

⭐️내돈내산⭐️ 솔직후기가 도움이 되셨다면
도움돼요 부탁드립니다 감사합니다🙇‍♀️💜",5
