user_id,product_id,product_type,review,rating
마싯는복숭아,611,,"17~19호 여쿨라입니다.

-색상
은색처럼 보여서 사이버틱하게 되는거아니야? 싶었는데 실물로 보면 그냥 밝은 핑크색입니다. 저는 눈 밑에 너무 진한 색을 넣으면 좀 튀는 타입인데 딱 좋았어요. 확신의 쿨톤 핑크입니다.

-펄
잔잔한 펄입니다.

-지속력
솔직히 지속력을 기대할만한 타입은 아닌데 일반 섀도우 바르는거보단 살짝 좋지만 섀도우 안에 바세린광나는 제품에 비해서는 밀착력이 떨어지는 편 입니다. 그래도 화장하고 엄청 날라가는건 못느꼈어요.

-내구도
저는 혹시 부러질까봐 오프라인으로 구매했는데 막상 손에 발라보니까 진짜 잘 부러질거같아요. 제품바르고 손에 삭삭 문지르는데 같은곳에 계속 문지르면 심 주위로 가루 뭉침이 생기더라구요. 진짜 섀도우 압축시켜서 만든 제품같은 재질입니다.

-총평
여쿨라에게 추천합니다! 눈밑에 색 너무 진하면 안어울리는데 딱 적당한 핑크색이라서 핑크핑크하지만 너무 색만 튀지 않아요. 정말 밝은 핑크색이라 아이보리 컨실러에 베이스~포인트 사이의 핑크색 섀도우 바른 느낌정도로만 올라와요.

도움이 되었다면 도움 눌러주세요 감사합니다 :)",5
마싯는복숭아,244,,쌉쌀하고 맛있는데 생각보다 부드러워요. 맛있습니다. 가끔 보이면 사먹어요.,5
마싯는복숭아,612,,"17~19호톤 여쿨라입니다.

여쿨에게 추천하는 블러셔입니다.

-용기
용기가 특이한데 처음에 한번 눌렀는데 화산마냥 터지길래 깜짝 놀랐습니다. 그 다음부터는 한번 누르면 똑 떨어지는 정도로 바뀌더라구요. 처음에는 좀 많이 나오는거 같아요. 아쉬운점은 한방울씩 떨어진다해도 뚜껑 끝에 살짝씩 남아서 묻는데 그게 좀 아쉬웠어요.

-제형
제형에 반해서 구매했는데요, 뭔가 싹 펴바르면 겉은 살짝 오일리한테 보송하게 마무리돼요. 저는 건성이라 살짝 오일리한게 좋더라구요.

-색상
색상은 마냥 뽀용하진 않고 살짝 여쿨라 블러셔치곤 명도가 차분하고 채도가 높은편입니다. 전 더 뽀용한걸 좋아하는 편이긴한데, 가끔 채도 높게 바르고 싶을때 좋아요. 근데 막상 펴바르면 그렇게 부담스러운 색은 아니라서 색상 자체는 잘뽑힌거같으나, 명도가 더 높았으면 좋았을거같아요. 뽀용한거 안어울리는 분들에게는 딱 좋은 블러셔 같습니다.

-총평
여쿨에게 추천하지만 특히 뽀용한거 안어울리는 여쿨에게 추천합니다. 여쿨 블러셔가 대부분 흰기가 많은데, 그런분들에게 좋을거같아요. 근데 그냥 여쿨이라면 무난하게 어울리는 블러셔입니다. 블러셔 진하게 하는거 좋아하는 분들은 정말 좋아할거같구 연하게 바르면 살짝 채도 있게 올라오면서 튀진 않아요.

도움이 되었다면 도움 눌러주세요 감사합니다 :)",5
마싯는복숭아,286,,"17~19호 여쿨라입니다.

-색상
색상은 포도즙색이에요. 살짝 어두운데 적게 바르면 여쿨라가 분위기있게 바르기 좋습니다. 쿨톤색상은 맞습니다. 겨쿨에게 추천합니다.

-광
광이 생각보다 빨리 사라져요. 처음에 틴트 팁으로 바를때도 생각보다 글로우 틴트치고 뻑뻑해서 놀랐는데 광이 시간지나서 올라온다는데 요즘 틴트들에 비해서 그렇게까지 광나는걸 느끼지 못해서 당황스러웠습니다. 기존 쥬시래스팅은 써본적이 없지만, 딱히 타 틴트들에 비해서 광에서 장점을 느끼지 못했고, 광의 지속시간도 매우 짧습니다. 색상이 어두운편인데 여쿨라가 바를 색상은 아닌걸 알지만 그래도 광이 너무 빨리 사라지니까 덧바를때마다 어두워져서 2번째 바를때 이미 너무 어두워서 제 얼굴에서 동동 뜨기 시작합니다..

-총평
재구매는 안할것 같아요. 광도 너무 빨리 사라지고, 아무래도 밖에서 활동하다보면 금방 마르는데 첫 터치만 마음에 들고 그 이후부턴 아예 덧바르질 못하니까 너무 어두워서 입술을 계속 지워서 다시 발라야하더라구요. 휘뚜루마뚜루 바르지 못해서 아쉽네요. 이 틴트의 장점은 가격이 저렴하고 여러 색이 있어서 접근성이 좋은거인것 같습니다만 저는 광이 너무 빨리 사라지고 뻑뻑해서 재구매의사는 없습니다.

도움이 되었다면 도움 눌러주세요 감사합니다 :)",3
마싯는복숭아,613,,"연근 팩입니다.

시트지가 부드러운 천 같아요. 불투명한 흰색 세럼이 가득 들어있습니다. 향은 뭔가 달콤한 화장품 향이나요. 독한 화장품 향은 아니라서 호불호는 크게 없을거 같아요. 근데 이거를 사용해서인지 여드름이 났더라구요. 순하다고 느껴졌는데 뭔가 제 피부에 안맞았나봅니다.

촉촉하긴한데 탄력이 있는건 모르겠습니다.",5
마싯는복숭아,48,,"생각보다 손이 잘 안가는 제품입니다..

17~19호 여쿨라고 채도는 적당하고 좀 밝은게 어울립니다.

도화핑크 색상이 채도가 생각보다 쎕니다. 립라이너랑 비교해도 꽤 채도가 있는 편입니다. 그러다보니까 적당히 문질러도 꽤 튀는 편이에요. 그리고 지속력이 약합니다. 아이라이너라지만 그냥 컨실러펜슬같은데 좀 무른타입같아요.

사용하는 방법은 도화핑크를 바르고 살짝 문지른 다음 아이보리 컨실러 펜슬로 위를 덧바릅니다. 혹은 도화핑크만 가운데 톡톡 바르고 많이 문지릅니다. 색상이 꽤 튀어서 제 눈엔 좀 튀더라구요. 그래서 엄청 살짝만 바르는거 아니면 튀는데 많이바르면 색상도 튀고 두꺼워져서 주름에 껴요.

생각보다 채도가 쎄서 놀랐던 제품입니다.. 그래서 손도 잘 안가는데 지속력도 그저 그래요.

그리고 그렇게 쿨하지 않습니다. 좀 웜한 편이에요. 극도의 쿨톤분들은 사는것 비추합니다.

추천대상은 평소에 눈 밑 화장 진하게 해도 어색하지 않은분들, 너무 쿨한건 안 받는 분들, 눈밑이 너무 건조해서 파우더로 된걸 바르면 건조함이 심하셨다 하는 분들입니다.

도움이 되었다면 도움 눌러주세요 감사합니다:)",3
마싯는복숭아,614,,"왜 비싼지 알겠는 제품입니다..

처음에 아무 볼도 주지 않아서 살짝 당황하긴 했는데 그냥 아무 병에 넣어서 저었습니다.

이미 저어놔서 편했고, 모델링팩 초보라서 손이 좀 느린데 생각보다 천천히 굳어서 편했어요.

근데 흰색이 세럼같은걸로 알고있는데 잘 저은줄 알았는데 잘 안저어졌는지 분리가 되었더라구요.

사용해보니까 겉이랑 안이 되게 촉촉해요. 모델링팩 자체에서 계속해서 수분이 나오는 느낌입니다. 떼지는것도 잘 떼지고 떼니까 피부가 좀 쫀쫀하고 수분가득한 느낌입니다.

타 워시오프팩을 했을때도 영양이라서 쫀쫀했었는데, 그거는 건성에게 추천하는 제품이였다면 얘는 피부타입 상관없이 사용할 수 있을거 같아요. 유분기같은거 안느껴지고 오직 수분감만 느껴집니다.

추천합니다. 살짝 비싸서 자주는 못쓸거같아요

도움이 되었다면 도움 눌러주세요 감사합니다 :)",5
마싯는복숭아,615,,"17~19호 여쿨라입니다.

디어에이 구매했다가 저한테는 조금 건조해서 웨이크메이크를 구해맸어요.

결과적으로는 웨이크메이크가 더 색상도 밝아서 저에게 잘 맞았고 덜 건조했습니다.

-건조함
여름에는 괜찮았는데 이번 여름이 너무 더워서 그런지 원래 건성이였다가 좀 많이 건성이 되었어요. 원래 괜찮았던 쿠션들이 다 건조하기 시작했습니다. 그래서 웨이크메이크 컨실러도 요즘 같은 계절에 쓰면 살짝 건조해서 아주 살짝만 사용하고 있습니다. 제가 사용해본 컨실러중엔 가장 촉촉해요.

-색상
색상이 전체적으로 밝게 나왔습니다. 타 컨실러들은 보라색은 너무 밝아서 저한테도 좀 떴는데 얘는 보라색, 초록색도 꽤 투명하고 명도가 낮아 잘 맞았어요. 다만 색상 자체가 강하지 않다보니 색상 커버하는 능력은 좀 떨어졌습니다.

-추천타입
기존의 컨실러 팔레트가 너무 어두웠다.
덜 건조한 컨실러 팔레트를 찾고 있었다.

-비추하는 타입
확실한 색상 커버를 원한다.
밀착력이 있고 매트한 질감의 컨실러를 원한다.

도움이 되었다면 도움 눌러주세요 감사합니다 :)",5
마싯는복숭아,616,,"17~19호 여쿨라입니다.

요즘 블러셔 이것밖에 안쓸정도로 추천템입니다.

-색상
뽀얀 핑크색입니다. 채도가 있으나 두드려주면 채도보단 흰기가 더 올라옵니다. 딱 바르면 채도랑 흰기가 적당해서 너무 하얀색을 바르면 볼이 뽀얗게 보이긴하지만 좀 하얗다는 느낌이 들텐데 얘는 너무 뜨지않을정도로 하얀데 채도가 있어서 너무 추천해요. 뽀얗고 흰기 도는데 볼에 발랐을때 제 볼에 비해서 더 밝아진다는 느낌은 안들어요.

-제형
립앤치크 제형 생각하시면 좀 많이 다를테고 단단한 크림제형인데 완전 단단한 크림에 비해서는 살짝 립앤치크처럼 좀 포슬거리는 느낌은 있어요.

-뭉침
계속 사용하다보니까 표면이 좀 뭉치더라구요. 근데 퍼프에 밀면서 양을 덜어내면 뭉치고 그냥 톡톡 찍으면 안뭉칩니다.

-커버력?
리뷰를 보니까 뭐 모공을 메워준다던데 그러면 벗겨질 가능성이 있어서 그냥 톡톡 두들겼습니다. 그래서 커버력은 모르겠어요.

-지속력
다른 색상은 모르겠는데 얘가 두드리면 두드릴수록 채도가 없어지고 뽀얘집니다. 그러다보니까 색상 자체가 연해서 엄청 바르지 않는 이상은 없어요. 색상 자체가 여리한 편이라서 금방 날아가는것 같습니다.

-블러리함
약간 글로우하진않고 피부위에 바른 쿠션 제형 따라가는것 같아요.

정말 추천합니다. 다 쓰면 아마 재구매할것 같아요. 가루블러셔랑 다르게 텁텁해지지도 않는게 장점입니다.

도움이 되었다면 도움 눌러주세요 감사합니다 :)",5
마싯는복숭아,617,,"베이스로 깔려고 산 제품입니다. 채도도 높지않고 명도도 적당해서 포인트립은 못돼는데 명도도 적당해서 여쿨라가 쓰기에 어둡지도 않고 밝아서 둥둥 뜨지 않아요.

근데 이게 생각보다 플럼핑이 쎄서 좀 당황했습니다. 그리고 알콜냄새나요. 플럼핑이 쎄서 입술 상태 좀 안좋은날은 안쓰게 되니까 그냥 손이 잘 안가요.. 그리고 광은 그저그래요.

도움이 되었다면 도움 눌러주세요 감사합니다 :)",3
마싯는복숭아,618,,무난한 제품입니다. 마데카솔에서 만든 제품이라 그런지 살짝 시카향나요.,5
마싯는복숭아,619,,"소금 알갱이가 있는 제품입니다. 첨엔 생각보다 안뻑뻑해보여서 손에 덜고 제품 사용해봤는데 안들어가더라구요. 기다란 입구를 머리에 넣고 해야 잘 사용할 제품입니다. 지성인데 유분기 잘 제거해주고 머리가 개운한 느낌입니다. 소금알갱이가 아무리 씻어도 잘 안녹는데 막 1시간씩 샤워할거 아니면 안녹는거 같습니다. 머리가 빳빳해질거같은데 은근 부드러워요.

도움이 되었다면 도움 눌러주세요 감사합니다 :)",5
마싯는복숭아,620,,"여름꺼 치고는 보습력이 꽤 있는 제품입니다. 다른 제품들 사용해봤는데 딱 보습력이 너무 없지도 않고 싹 흡수되게 만들려고 했는지 잘 흡수되는 마지노선까지 수분감 넣은 느낌...? 괜찮았어요. 근데 지금 계절에 쓰기엔 확실히 가볍더라구요. 여름용으로는 재구매할거같아요. 향도 시트러스 향이라 가볍고 진짜 레몬향 느낌? 향도 좋습니다.

도움이 되었다면 도움 눌러주세요 감사합니다 :)",5
마싯는복숭아,621,,"피부가 엄청 예민한 편은 아닌데 꽤 많이 아팠습니다. 사용 후 다음날에 세수하는데도 따끔따끔거리더라구요. 저한텐 많이 아팠어요. 손가락에 좀 날카로운 굳은살 박힌상태로 얼굴 문지르는 느낌이에요.

아프기도하고 가격도 쎄서 효과가 있어야하는데 솔직히 엄청난 효과를 느끼진 못했어요...

처음에 구매하실분은 300말고 100부터 시작하는게 좋을거 같아요.

도움이 되었다면 도움 눌러주세요 감사합니다:)",3
마싯는복숭아,622,,"가격이 저렴해서 좋긴한데 팩 인중이 너무 얇아서 당황했어요.. 저렇게 인중 얇은거 처음봐요.
팩 앰플은 투명해요. 팩이 앰플을 듬뿍 흡수해서 얼굴에 사용하니까 막상 껍데기에 남아있는 앰플은 없더라구요. 촉촉하긴한데 막 사용 후에 영양 꿀광이라는데 엄청 촉촉한건 모르겠어요. 그냥 일반 앰플 사용한 느낌입니다. 좀 안색이 괜찮아질정도의 영양이 느껴지나?? 싶어지는데 애매했어요. 가격이 저렴해서 저렴한 맛에 쓰면 좋긴 할거같아요.
그리고 꿀냄새가 아니라 프로폴리스 냄새나서 약간 호불호 많이 갈릴거 같아요.

도움이 되었다면 도움 눌러주세요 감사합니다 :)",4
마싯는복숭아,623,,재구매템입니다. 날개가 잘 붙고 통풍도 잘 돼요. 솔직히 날개가 잘붙어서 계속 구매하고 있긴해요. 날개 너무 잘떨어져서 화난 분들에게 추천합니다.,5
마싯는복숭아,459,,"계속 재구매하고 있어요. 닦토할때 좋아요. 팩토하기엔 얇고 뻣뻣해서 떨어져요. 화장지울때도 좋은데, 좀 단단한 편이라서 눈 닦을때 흐물거리지 않아서 눈 밑에 슥 닦기 좋더라구요.",5
마싯는복숭아,624,,탱탱하고 물렁해요. 살짝 단단한편이긴 합니다. 사용하기 간편해요. 그냥 손이랑 바르는거랑 솔직히 비슷한데 손에 뭐 묻는거 싫은 분들에게 추천해요,5
째둘리,15,,언제 리뉴얼이 된건지 불투명한 용기에서 투명한 용기로 바뀌었네요.. 늘 재구매하던 제품이고 양도 많고 순하고 각질제거에도 효과가 있어서 만족하면서 사용하고 있습니다. 또 리필제품이 나왔으면 좋겠고요.. 무난하게 사용하기 좋은 토너예요...,5
째둘리,625,,"거품 잘 나고 세정 잘 되고
아침세안에도 좋아서 늘 재구매하는 제품입니다.
처음 쓰는 분들은 티트리향에서 호불호가 갈리겠지만
저는 이미 익숙해져서 괜찮아졌어요ㅜ
저렴하고 좋습니다.",5
째둘리,86,,"일단 향이 연하게 한약? 향이 나더라고요.
이건 호불호 있을 수도..
그리고 피부 타입마다 자극이 느껴지는 분들도 있는 것 같아요. 저는 괜찮았습니다.
점성이 있는 타입이고 흡수는 깔끔한 편입니다.
겨울에 사용하기 괜찮을 것 같고
지성분들에게는 번들거릴 수도 있을 것 같은...
일단 저렴한 게 장점이고 효과는 계속 써봐야 알 것 같네요",4
째둘리,378,,쓰던 샴푸가 안 맞아서 바꿔봤는데 생각보다 너무 좋았어요. 호불호가 좀 있는 거 같던데 그 이유를 알겠더라고요. 일단 지성두피용이라 샴푸 후에 머리카락이 엄청 건조해지고 뻣뻣해집니다. 그래서 린스나 트리트먼트를 왕창 해야해요.. 그치만 두피 간지러운 게 없어져서 너무 좋아요.. 세정력도 좋고 향도 나쁘지 않아서 저는 재구매의사 완전 있습니다^^,5
째둘리,626,,"디자인 귀엽고 휴대용으로 갖고 다니기 딱입니다.
가방에 넣기 좋은 크기예요.
가격 맞추려고 산 거지만 휴지는 언제 어디서나 늘 필요하니까요 500원의 행복이네요^^ 굿입니다~",5
째둘리,627,,뿌리고 바로 씻어내는 것보다 뿌려놓고 좀 방치해뒀다가 씻어내는 게 더 효과가 있는 것 같아요. 저는 개인적으로 쿨링향을 제일 좋아하는데 레몬/자몽향만 자주 세일 하더라고요ㅜ 쨌든 발을 씻자 너무 편리해서 매번 구매하고 있습니다! 대용량 조아용♡,5
째둘리,517,,오메가3 알약은 너무 커서 최대한 작은 크기로 찾다가 프로메가 제품으로 구매하게 되었습니다. 알약을 잘 삼키지 못하는 편인데 이건 크기가 작고 가벼워서 삼키기 편합니다. 두알 먹어야하는 불편함은 있지만 어쨌든 섭취했다는 게 중요하니까요^^ 꾸준히 구매할 예정입니다.,5
째둘리,628,,"혀클리너 처음 써보는 거라 일단 저렴한 걸로 구입해봤어요. 매번 칫솔로 혀 닦다가 요즘들어 잘 안 닦이는 느낌이 들어서 혀클리너 구입해봤습니다.

일단 포장 뜯어서 바로 쓰기에는 좀 찝찝한 것 같아서 치약으로 한번 씻어주고 사용했습니다.

칫솔처럼 박박 닦기에는 조금 거칠기도 한 것 같아서 손에 힘을 조금 빼고 사용해봤어요. 이건 사용하면서 감을 익혀야 할 것 같아요.

일단 사용해보니깐 칫솔로 닦는 것 보다는 훨씬 혀가 깨끗하게 닦아지는 것 같구요. 힘을 많이 주면 혀에 자극적일 것 같아요. 그러니깐 꼭 힘을 빼고 사용해야할 것 같아요.

길이가 너무 길지도 짧지도 않아서 입안에 넣기 좋고 구역질도 안나고 편합니다. 확실히 혀클리너를 사용하는 게 입안이 더 개운한 느낌이 있네요

재구매 의사 완전 있습니다 굿굿~",5
째둘리,629,,"보통 새 치약은 치약이 꽉 차서 빳빳하지 않나요? 이건 뭔가 공기가 많이 들어간 듯한.. 치약을 짜려니깐 빳빳하지 않고 물렁물렁하네요..

불소함량이 많다고 해서 치약이 좀 독하지 않을까 했는데 생각보다 되게 순한 느낌이네요. 치약의 쏴하고 시원한 느낌은 없고 그냥 엄청 순해요. 치약의 매운느낌이 하나도 없어요.

치약을 조금이라도 많이 짜서 사용하면 바로 입안이 하얗게 벗겨지네요ㅠ 무조건 완두콩만하게 짜서 사용하고 양치 후 물로 많이 헹궈야 할 것 같아요.",4
째둘리,630,,"일단 순하고요. 자극이 없어요.
특유의 파마약 냄새도 없고 과일향이 나서 좋아요.
모가 많고 길고 두꺼운 분들은 10분까지도 괜찮을 듯 합니다.. 사바사겠지만 한 번 해보시고 잘 제거가 안된 분들은 10분 정도 해보세요.. 재구매의사 있습니다^^",5
째둘리,631,,"늘 재구매하는 제품입니다.
가격도 저렴하고 양도 많고 가격에 비해 질도 괜찮고 닦토로 사용하기 좋고 피부에 자극없고 보풀도 적고
지퍼백으로 위생적으로 보관도 가능해서 아주 좋습니다.",5
째둘리,632,,"블랙헤드 제거에 효과가 있어서 좋아요.
세안하면 확실히 피부가 깨끗해집니다.
클렌징도 잘 되고 피부에 자극도 없고 좋습니다.
클렌징 후 건조함도 안 느껴집니다.
사은품으로 여행용 오일도 얻어서 완전 유용하게 사용하고 있습니다. 재구매 의사 있습니다 굿~",5
째둘리,378,,"일단 저는 머리숱이 굉장히 많아 두피에 열감이 많고 땀이 많은 편입니다. 샴푸는 그냥 아무거나 저렴한 제품으로 사용하는 편이었는데 요즘들어 머리를 감아도 머리가 계속 간지러워서 샴푸를 한 번 바꿔보자 라는 생각으로 헤드앤숄더 제품을 골랐습니다.

일단 제품 이름부터 쿨멘솔이라 멘솔향이 강할 줄 알았는데 옅은 오이비누 냄새? 정도라 향은 나쁘지 않았습니다.

지성두피용 샴푸이다 보니 머리를 감으면 머리카락이 굉장히 뻣뻣하게 씻겨집니다. 이 점이 보통의 샴푸 느낌과는 다르더군요. 그래서 샴푸 후 트리트먼트나 린스를 잘 사용해야 할 것 같습니다.

하지만 두피는 시원해지는 느낌이 들어 머리숱 많은 사람들에게 좋을 것 같습니다. 머리를 감은 후에도 두피가 시원하고 머리를 긁어도 하얗게 나오던게 없어졌습니다

일단 더 사용해봐야 알겠지만 두피에 자극 없고 세정력도 괜찮고 거품도 굉장히 잘 나서 첫 느낌은 만족합니다!",4
째둘리,626,,"금액 맞추느라 저렴한 걸로 구매해봤어요.
티슈는 언제 어디서나 필요한 필수품이죠.
휴대용으로 갖고 다니기 편한 크기이고
포장지가 귀여운 디자인이라 그냥 기분이 좋아요ㅋㅋ",5
째둘리,627,,"제 기준 향은 쿨링,자몽,레몬 순으로 좋은 것 같아요.
510ml라 마음껏 쓸 수 있고 발 씻기 편해서 항상 대용량으로 재구매 하고 있어요.

거품 비누라 발을 뽀득뽀득 닦을 수 있고 향에 따라 발에서 향기도 납니다ㅎㅎ",5
째둘리,517,,오메가3의 필요성은 알지만 알약이 대부분 크게 나와서 안 먹고 있었는데 이번에는 한번 먹어보려고 작은 알약으로 구매해봤습니다. 하루에 두번 섭취하는 거라 번거로움은 있지만 약 삼키기가 그나마 편해서 먹기 좋아요 할인만 자주 한다면 재구매의사 완전 있습니다! 제발 효과가 있었으면 좋겠네요..,5
째둘리,633,,가격도 저렴하고 양도 많고 화장솜까지 증정이라 완전 이득인 상품이에요! 순하고 누구나 무난하게 사용하기 좋은 스킨이라 지인에게 선물했습니다.,5
째둘리,630,,"해마다 올영에서 판매하는 제모크림 이 제품 저 제품 많이 사용해봤는데 이 제품이 가장 향이 좋은 거 같아요. 거의 파마약 냄새가 대부분인데 이 제품은 전혀 냄새가 안나고 과일향이 나서 괴롭지 않았어요!

그리고 스파츌라 아니면 스펀지가 들어있는데 이 제품은 스펀지가 들어있어요. 제모크림을 닦아낼때는 스펀지가 편한데 크림을 바를 때는 스파츌라가 더 편해서 조금 아쉽긴 해요.

제모력은 나쁘지 않아요. 일단 제모크림은 무조건 두텁게 발라야해요. 얇게 바르면 안되고 덕지덕지 발라야 제모가 됩니다. 설명서에 8분을 넘기지 말라고 써있어서 한 7분 정도 해봤는데 깨끗하게 제거는 안되더라고요. 일단 제품을 바르고 어느정도 시간이 지났는데도 자극이 느껴지지 않거나 본인의 모가 굵거나 많다고 생각되시는 분들은 10분까지는 괜찮을 것 같은 느낌이에요. 그 정도면 깨끗하게 제모될 것 같은 느낌..

피부자극 없었고 할인행사로 인해 저렴하게 구입할 수 있어서 좋았어요. 오프라인 매장에서도 구매할 수 있었으면 좋겠네요!",5
째둘리,631,,가격도 저렴하고 양이 많아서 늘 재구매하는 제품입니다. 저렴한 가격인데도 솜이 부드러워 피부 자극이 없고 보풀도 적은 편이라 아주 만족하면서 사용하는 제품입니다. 좋아요!!,5
째둘리,632,,한스킨 클렌징오일이 제일 블랙헤드가 잘 제거되는 것 같아요. 클렌징 후 피부가 말끔해져서 아주 만족합니다. 제품이 순하고 좋아요. 30ml짜리도 사은품으로 받았는데 여행용으로 아주 좋을 것 같아요! 잘 사용하겠습니다^^,5
할루올리브,634,,"💙🖤미장센 블랙핑크 염색약🖤💙

비싼ㅜ 로레*보다 간편한 용기에 사용하기 편해요~ 얼마전에 샀던 로레* 돈만 버리고 뿌리 염색 기간이 점점 다가와서 봐두었던 미장센 염색약을 샀어요~ 블핑 모델 색상들마다 인기네요😄 진한머리여서 그런가 로레*은 색상이 절~대 안 나왔는데 딱 원하는 색상은 안 나왔지만 가격대가 더 저렴하게 효과는 괜찮은 듯 해요~ 진한 머리쪽으로는 염색이 잘 안 나오지만 뿌염 나오는 부위는 심하게 바뀌지 않게 염색되고 자극은 보통이에요~ 물론 귀쪽하고 묻은 부위는 좀 걱정이 됐는데 큰 자극없이 발림성도 괜찮았는데 양을 많이하면 흘러내림이 생길 수 있어 좀 주의해야 합니다~ 귀에 보호캡 끼고 미용실에서 타인이 해주면 훨 편하긴 하지만 물가도 막 오르고 일을 하는지 마는지 바다에 방사능오염수 대책도없는시국에 미용실 염색값이 여간 비싸서 말이죠; 염색약을 자주 쓰는것도 인체나 자연에 안좋을것 같아서 한방에 잘되는 국내염색약 개발되면 좋겠네요",4
할루올리브,635,,"sns 대란템이라는데 사용법을 잘 몰라서 그런지
볼륨 브러쉬로는 잘 못쓰고 있어요😂 대신 그냥
빗으로 쓰기에도 얼기설기 빗이 엉키지 않고 편해서
잘 쓰고 있습니다~ 디자인도 딱 간편해서 좋아요~",5
