user_id,product_id,product_type,review,rating
으라차차,21,스킨/토너,"다른 토너를 선물받아서 쓰고 있었는데 다시 돌아왔어요.
제가 써본 토너 중에서 제일 괜찮은 토너였습니다.
지성이 사계절 내내 쓰기에 좋은 토너라고 생각해요.

우선 제형은 물 같은 제형입니다.
개인적으로 끈적이는 점성이 있는 토너는 극혐하는데 이 토너는 그렇지 않아요. 끈적이지 않아서 더운 여름에 산뜻한 느낌으로 쓸 수 있는 것 같아요.
지성이신 분들은 사계절용으로 쓰기에도 좋아요.
색상도 투명해요.
향도 무향이라 향에 민감한 분들이 쓰시기에 좋아요.

닦토로 쓰기에도 좋고 두드려서 흡수하는 토너로 쓰기에도 좋아요.
두 가지 방법 모두 괜찮았는데 저는 주로 닦토로 씁니다.
끈적임이 없기 때문에 사용 후 깔끔한 느낌이 들더라구요.
흡수하는 토너로 쓸 때에는 흡수가 빨라서 좋았습니다.
겉돌지 않고 바로 흡수가 되어서 가끔씩 톡톡 두드려서 흡수해서 씁니다.

꾸준히 사용하다보니 전반적으로 결이 정리된 느낌이었어요.
처음 한두번 쓸 때는 몰랐는데 계속 쓰다보니 느껴지더라구요.

대용량이고 가격도 저렴한 편이라 좋아요.
저는 화장솜에 토너를 듬뿍 적셔서 쓰는데 가격 대비 양이 많은 편이라 좋았습니다.

그리고 개인적으로 이 제품은 비피다 앰플과 같이 사용했을 때 가장 좋았어요.
토너만 써도 좋았지만 앰플과의 조합이 정말 최고입니다:)
비피다 앰플이 있는데 토너는 아직 구매하지 않으신 분들은 이거 꼭 구매하세요!",5
Jenny17,21,스킨/토너,"처음에 구매하게 된 계기는 엄마드리려고 샀어요! 예전에 엄마 화장품 한번 안맞는거 쓰시고 뒤집어져서 고생하셨거든요. 그때부터 피부 좋아졌다 나빠졌다를 반복하고 있는 상태셨어요~~ 근데 최근에 마녀공장 비피다바이옴 토너, 앰플 샘플을 우연히 써보셨는데 너무 좋다고 하시더라구요~~ 또 안맞는 화장품 쓰시면 염증같이 올라오는데 이건 괜찮았다고 하셔서 바로 사게 됐어요! 본품과 100ml 증정이 들어있어 증정품은 제가 써봤는데요~~ 오 지금까지 이걸 왜 안썼나 싶을 정도로 너무 좋더라구요~~ 피부에 자극 전혀 없구요 사용 후 피부가 진짜 산뜻하고 가벼운게 느껴지더라구요~~ 피부가 간지럽거나 당기는거 전혀 없고 엄청 보들보들해진 느낌이 났어요!! 엄마가 앰플도 좋다고 하셔서 곧 앰플도 사용해 볼까 싶어요 예민한 제 피부에 잘 맞아서 성분을 한번 찾아봤는데 성분이 좋더라구요~~ 피부 예민하신분들도 쓰실 수 있을 것 같아요! 토너 제형이 흐르는 물 타입이라 저는 닦토로 사용했고 사용 후 톡톡 두드려줬습니다! 마녀공장 쓰고 있는 제품들이 다 좋아요!",5
플쑈,21,스킨/토너,"원래는 토너패드를 사용하다가 어느 순간 자극이 느껴져서 그냥 패드 없이 토너만으로 톡톡 두들기며 사용했어요! 처음에는 닦지 않아서 조금 찝찝했는데 사용할수록 피부가 더 보드라워지는 기분? 그리고 더 진정되는 느낌이라 이제는 아예 패드 사용 하지 않고 눈화장 했을때만 사용합니다! 저번부터 마녀공장 궁금해서 사용해보고싶었는데 이제서야 써보네요 ㅎㅎㅎ 물처럼 줄줄 흐르는 제형이지만 얼굴에는 챡! 달라붙는 것 같고 수분도 채워주는 느낌이에요! 아끼지 않고 3번씩 톡톡 두들겨주니 얼굴이 점점 맑아지는 것 같아요 ㅎㅎ 이제 앞으로 패드는 안쓰고 이렇게 토너 제형으로 쓸거에요!
자극도 하나도 없고 순한데다가 향기도 없어서 믿고 마구 쓸 수 있습니다 그리고 눈이 예민한편이라 자극있는 토너 쓰면 눈이 바로 따가운편인데, 마녀공장 앰플토너는 눈도 하나도 안따가워요!!!!! 이제 이 토너로 정착할 생각입니다. 이거 쓴지 거의 한달 되어가는데 1/5 정도 사용한 것 같아요 확실히 패드보다 오래 사용할 수 있어요
아주 팍팍 사용하는데도 말이에요 !!!!!! 아침저녁으로 3번씩 톡톡 두르려쥬니 잠도 깨는 기분이구요 ㅋㅋ! 100미리 증정으로 같이 받아서 여행다닐때에도 잘 가지고 다닙니다 ㅎㅎㅎㅎ 토너 순하고 촉촉하고 향 없는 저자극 찾는다면 마녀공장 앰플토너 추천하겠습니다!!!!",5
Seonii,21,스킨/토너,"지성피부에게 좋을 법한 가벼운 농도의 토너예요

저한테는 아주 안 맞는 토너입니다,, 토너팩으로 이틀 동안 사용했는데 그 부분만 뾰루지 폭발이에요.. 피부도 거칠어지구ㅠㅠ 저는 발효성분이 안 맞는 것두 아니고 성분 봤을 때도 안 맞을 법한 건 없었는데 왜일까요ㅠㅠㅠ 근래 피부 좋아져서 한 번 시도해봤는데 원상복귀예요..

이 토너 사실 분은 사기 전에 꼭 테스트를 해보세요!!",1
츄베룝,21,스킨/토너,"유튜버 유나님의 추천을 보고 구매하게 되었어요 ㅎㅎ

바이옴 성분이 피부 본연의 건강을 찾아주는 성분 이라길래 요즘 마스크로 예민해진 제 피부를 되돌리기 위해 사용해봤어요
결과는 만족입니당👌👍⭐️

바이옴 앰플토너에 대해 리뷰해볼게요📝

☑️제형이 묽고 물같아요 ㅎㅎ 그런데 물토너보다는 약간 보들 촉촉한 성분이 섞여있어 미끌한 느낌이라고 해야하나 ㅎㅎ

☑️기분에 따라 닦토로, 얼굴에 톡톡 떨어뜨려 스킨으로, 가끔 화장솜에 가득 뭍혀 스킨팩으로 사용하고 있어요

☑️향은 저는 거의 느껴지지 않을 정도였고 코를 대고 킁킁 맡아보면 약간 유산균 냄새같은 눅눅한 냄새가 나요 ⁉️

☑️수분감이 강력하고 한번 발라도 엄청난 보습력 까지는 아니지만 두번정도 스킨처럼 발라주면 에센스 따로 안발라도 괜찮을정도 였어요 토너가 가벼워요

☑️ 스킨팩을 해주면 거칠고 오돌톨톨했던 피부가 매끈해지고 수분이 속부터 차는 느낌이 확실히 들어서 맘에 들어요 스킨팩이 닿았던 곳과 안닿있던 부분이 확실히 다르네요!!",5
후츄춧,21,스킨/토너,"마녀공장 토너는 무색 무향 무취라는 점이 가장 좋네요!
보통 색상이 첨가되면 뭔가 피부에 화학물질을
바르는 기분이라 안 좋아하는데
마녀공장 토너는 영양 가득한 물을 바르는 느낌이에요!
ㅎㅎㅎ

특히 앰플 토너라 완전 묽지 않고 약간의 점성이 있어서
조금 더 보습이 되는 느낌이에요!
실제로도 보습 효과가 있구요

저는 특히 밤에 솜에 적셔 진정용 팩으로 사용해주니
다음날 피부가 부들부들 수분이 가득차서 주로 이 방법을 사용해요!! 여기에 본인이 쓰는 앰플을 조금 더 넣어서 붙여두면 완전 짱!! 꿀팁이에요 ㅎㅎ

양이 꽤 많은 편이라 듬뿍 발라도 부담이 없으니
한번은 닦토하고 한번은 손에 덜어
챱챱 두들겨주면 흡수가 더 잘 되니
꼭 해보세요!!

가격 대비 좋은 상품이에요
★별 다섯개!★",5
으라차차,21,스킨/토너,"항상 쓰던 토너가 있었는데 마침 이 제품이 세일이기도 했고 원래 비피다 앰플을 쓰고 있어서 구매해봤어요.
이왕이면 쎗뚜쎗뚜로 써보고 싶더라구요:)

제형은 물토너 같은 제형이네요.
시럽같은 제형의 토너를 즐겨 쓰지 않아서 저는 좋았어요.
닦토로 쓰기 좋아요.
앰플토너라고 써있어서 혹시 살짝 끈적임이 남는 토너면 어떡하나 싶었는데 그렇지 않아서 좋아요. 쓰고 나면 깔끔한 느낌이었어요.

같은 라인의 앰플이랑 비교했을 때 두 제품이 다른게 딱 보여요.
비교사진 첨부했으니 보세용:)
앰플은 진짜 흔히 생각하는 살짝 흐르는 정도의 제형이고 토너는 진짜 물같은 제형입니다.
색상도 앰플은 갈색빛이 강한 편인데 토너는 색이 없어요. 물같아요.

용량 대비 가격도 괜찮아서 닦토로 자주 사용하시는 분들한테 좋을 것 같아요.

앰플을 벌써 4병째 쓰고 있는데 이 제품도 다 쓰고 아마 재구매할 것 같아요.",5
djawjdt****,21,스킨/토너,자극없이 순하고 닥토용으로 잘쓰고있습니다.양도 많아서 좋아요,5
yhsun****,21,스킨/토너,"양도 많고 닦토로 매일 사용하기 나무 좋아요
오래 쓸거 같아여",5
gmlwj****,21,스킨/토너,여러 스킨 구매하여 사용해봤지만 이 스킨만한 제품이 없어요. 닦토에는 이게 제일입니다. 거기다 가격까지 착해요,5
myle****,21,스킨/토너,"한 달 정도 사용하고 나면 저한테 맞는 제품인 것 같아요. 피부 개선도 되고, 더 쓰면 다시 살 수 있을 것 같아요",5
wldl****,21,스킨/토너,유명해서 한 번 구매해봤는데 닥토하거나 머리 말릴 때 팩토하면 좋을 것 같아요 순해요,5
핑핑팡,21,스킨/토너,피부가 엄청 자극을 받은 날일 때는 쓰지 않는 게 좋은 것 같아요 다른데서 계속 사다가 올영이 싸길래 여기서 샀는데 다 쓰면 재구매 할 것 같아요 팩토 추천,5
Kenn,21,스킨/토너,바이옴 앰플 토너는 피부 보습과 진정 효과를 제공하여 피부를 건 강하게 유지하는 데 도움을 줄 것입니다. 큰 용량으로 경제적이며 지속적인 사용이 가능할 것입니다,5
roseyoon,21,스킨/토너,순해서 조아요!!! 끈적거리 1도 없는 물 제형이라서 여름에 쓰기 좋아요 그리고 팩하기도 좋아요!!,5
하핳핳,21,스킨/토너,"- 마녀공장 앰플토너

토너가 필요해서 마침 세일도해서 구매했는데 ㅋ ㅋ 양은 많고 좋아요 물토너라서 세안후 닦토하기 좋네요 향도 없어사 민감하신분들 사용하기 좋아요~~ㅎㅎ",5
뽀야올리브,21,스킨/토너,"☆마녀공장 앰플 토너☆

고등학생 딸이 쓰려고 구매했습니다~
가볍고 좋아요♡",5
히히홍,21,스킨/토너,"마녀공장 좋다는 건 익히 알고들 계실테고..
가격이며 성분 뭐하나 부담스러운 것 없이 좋아요!
N년째 닦토로 무한 이용중입니다!",5
히히홍,21,스킨/토너,"늘 사용하던 토너에요! 대용량이라 가성비도 좋고 비피다 성분도 좋지요! 추가 구성 프로모션도 마음에 들었어요.
세안 후 첫 닦토로 적극 추천이에요~!",5
임성혜,21,스킨/토너,"음 사용전에 리뷰 올리긴 처음이네요 쓰는게 문제는 없겠지만ㅋㅋㅋㅋ 보고 놀랐습니다..
뚜껑이 이렇게 되서 올줄이얔ㅋㅋㅋㅋ",4
코덕이취미,21,스킨/토너,"향은 거의 무향에 가깝고 제형은 거의 물제형이에요. 흡수력 빠르고 분명 토너를 발랐는데 앰플을 같이 바른 느낌이 나요. 바르고 나면 뭔가 피부에 막이 씌인듯한 느낌? 끈적임 없고 촉촉한데 산뜻하게 마무리되요. 보습력도 길게 유지되는 편이에요. 아침에 바르면 저녁까지는 괜찮았어요.

속건조도 잘 잡아주고 닦토나 흡토 둘다 사용하기에도 좋아요. 저는 수부지+민감성 피부이지만 순하고 촉촉해서 모든피부 사용 가능하고 사계절 아무때나 무난하게 잘 사용할 수 있을 거 같아요.

가격도 400미리 + 100미리 추가구성에 세일하면 만원 중후반대라 가성비도 좋고 온가족용으로 사용하기에도 좋을 거 같아요🤗",5
다이아는웜톤girl,21,스킨/토너,"기대 안하고 샀는데 생각보다 너무 좋어요!!!
마녀공장 기초라인 폼 미쳤어요
입소문 더 타야돼요",5
bawp88,21,스킨/토너,토리든 쓰다 너무 물같은 느낌이라 이걸로 사봤어요! 미끄덩한 느낌인데 촉촉하고 당김도 없네요~,5
동동동혀니,21,스킨/토너,"브링그린 토너 쓰다가 가을 되니까 좀 땡겨서 마녀공장꺼 사봤는데, 좀 더 점성?이 있는 느낌이라 보습력이 괜찮네여",5
gydms****,21,스킨/토너,"태어나서 처음 스킨이 필요하다는 남동생에게 선물했어요
증정품은 제가 슬쩍했지만요(여행갈때 딱 조흔 사이즈)
모든 피부타입이 사용 가능한 스킨 같아요~
건성도 두번 정도 레이어드하여 발라주면 결정리 겸 수분 충전 가능해요~",5
부처핸섬,21,스킨/토너,바이오더마 파란색 통만 쓰다 환절기라 구매해썽요 순하고촉촉해서 좋어요,5
윈터뷰,22,스킨/토너,"순하고 잘 흡수돼요
예민한 피부인데 트러블없이
잘 사용중입니다",5
군만두헌터,22,스킨/토너,어성초 에센스 물로된거 사서 계속 썻었는데 단종 ㅠㅠ그래서 안쓰다가 걍 간만에 생각나서 토너라도 사봤어요,5
byul,22,스킨/토너,"닦토로 사용하느라 대용량 토너를 원했는데 리필용 세트로 구매하길래 사용해봤어요. 사용감이 좋고 향도 나쁘지 않은데 가격도 저렴해서 잘 사용하고 있어요. 끈적임도 없고 수분이 부족하지 않은 느낌이라 편하게 매일 화장 전,후 세안 후에도 잘 사용하고 있어요.",5
nooyy,22,스킨/토너,"자극없이 순해서 아침저녁으로
잘 발라주고 있아요
세일할 때 샀네용",5
헤이에뿔,22,스킨/토너,"완전 물 제형이라서 여름에 더 좋을 것 같아요
약한 민트향이 은은하게 나는데
전 좋았어요:)
화장솜 대량구매해 둔게 있어서 팩토도 야무지게 만들어서 쓰려고요",5
온돌멩,22,스킨/토너,그냥 슥슥 사용하기 좋은 물토너입니다~! 성분 잘 찾아보고 구매해서 민감성피부인 남친더 잘 쓰고있어요!,5
플레인요구르트,22,스킨/토너,흡수가 잘되고 자극이 적어 쓰기 편안해요. 재구매 의사 있습니다.,5
뚜34,22,스킨/토너,토너는 대용량아니면 이제 못 쓰겠어요 ㅠ ㅠ 제품도 구성도 넘 좋아요,5
염둥,22,스킨/토너,"✔️ 몇년째 제 얼굴을 책임지고 있는 구달 어성초 토너

몇년전에 토너 한번 사볼까 해서 사봤던 구달 어성초 토너였는데 지금까지도 쭈욱 사용중인 토너예요 !

리뉴얼 되기전부터 꾸준히 사용하기도 했고 선크림까지 다 구달 브랜드를 사용중이다보니 그만큼 저한테 잘 맞는 브랜드랍니다 ㅎㅎ

가격대도 저렴하기도 하고 건성이고 약간 ? 예민한 피부인데 순하고 얼굴에 트러블 한번 올라온적 없고
가끔 왁싱을 하다보면 얼굴이 화끈거리는 경우가 있는데 그때마다 솜에 묻혀서 열기 내리려고 쓰는 경우도 있는데 그때마다 만족스럽게 열기도 잘 내려가고 예민한 피부도 잘 사용할 수 있는 그런 토너였던거같아요 :)

향도 인위적이지도 않고 과하지도 않아서 무향에 가까운 ? 향이라서 그런지 저는 그런 향이 오히려 좋더라구요

앞으로도 쭈욱 함께할 구달 토너예요 🫶🏻",5
정지앙기모띠,22,스킨/토너,패드 3통 정도 사용했는데 패드가 두툼해서 항상 사용하고 버릴때 너무 아깝다는 생각이 들고 아침에 바쁠때 그걸 붙이고 있을 겨를이 없더라고용 용량 대비 저렴한것 같아요,5
얼리브용용,22,스킨/토너,무난하게 사용할수 있는 토너입니다 세일가격에득템하엿습니다,5
네코데수,22,스킨/토너,"몇주동안 사용하면서 피부에 큰 변화는 못 줬는것 같아요
그냥 자극없이 데일리로 사용하기 그럭저럭 좋은정도?
나쁘진 않았지만 다시 구매할 의사는 없을것 같아요",3
히헤,22,스킨/토너,항상 사용하는 토너인데 너무너무 좋아요 용량도 많아서 더 좋아요,5
timing,22,스킨/토너,"향이 없음
중복합성에 괜찮음
사계절 다 사용하기에 괜찮는거 같음",5
여쿨라17,22,스킨/토너,올영세일에 가격 맞추려고 구매했어요 그저 그래요... ㅎ,5
wls3****,22,스킨/토너,지인이 써서 한번 써봤는데 보습감이 너무 좋아서 구매했어요 ! 확실히 다음날에 피부 당김도 적고 진정도 되는 거 같아요,5
yoo****,22,스킨/토너,닭토로 사용중 입니다 용량이 많고 순해서 좋습니다 보습감은 덜하고 촉촉함이 있습니다,5
나는공주인가십주인가,22,스킨/토너,스킨 원래 쓰던제품이라 행사할때 사서 너무 좋네요 건성이라 스킨을 정말 물쓰듯 쓰는데 용량이 넉넉해서 좋아요,5
ejgukhee****,22,스킨/토너,요새는 피부가 예민해져서 아무거나 바르면 일어나고 그러는데 구달 어성초 라인은 저자극으로 순하고 부담없이 바를 수 있어서 좋아요! 원래는 스킨 토너는 다른 회사 제품을 썼었는데 토너까지 맞추고 나니 피부에 촥 더 잘 먹는 느낌이랄까!! 무튼 너무 만족해요!!,5
명쪽,22,스킨/토너,무난하게 물토너 처럼 쓸 수 잇을 것 같아용 죠아용!~ 재구매는 아직 모르겟어영,5
혜정20,22,스킨/토너,왠지 히알루론이 있으니까 피부가 촉촉해지고 진정도 되는 것 같아요~ 그리고 이거 냉장고에 넣어서 사용하면 붇기도 빠지는 것 같구요,5
솔직하게후기씀,22,스킨/토너,"진짜 최악,, 제가 구달 기초를 클럽클리오 매장이였을때 부터 사용했는데요 구달 어성초 에센스가 리뉴얼 돼서 나온게 어성초 스킨이다 !! 라고 하길래 구매했는데 완전 개별로에요,,
향은 무향이고, 가벼운 제형인데 유분감이 너무 많아요 기름 폭팔 ;;; 어성초 에센스는 유분이 많거나 하지 않았는데 어성초 토너는 유분이 너무 많아서 화장이 안 이쁘게 무너지더라구요 진짜 환불하고 싶은데 환불도 안되고 돈 겁나 아까움
어성초 에센스 사용하다가 대체품으로 사는거면 비추천",1
도쿄무스메,22,스킨/토너,기대보다 좋아요. 여름철 땀을 많이 흘려 지친피부 진정에 사용하려 구입했어요. 보습력도 좋네요.,5
마리안네,22,스킨/토너,"때마침 기존 쓰던 닦는 토너가 다 떨어져서 구매하려단 차에 이렇게 체험단으로 신청할 수 있어 너무 좋네요 ㅎㅎ

어성초 기초 라인들이 보통 수분감 있는 제품이라 괜찮을것 같아 신청해봤어요. 저의 경우 건성 복합 중간이지만 여름 다가오고 하니 좀 묵직한것보단 가볍게 닦을 토너가 필요했던지라 ㅋ

양도 대용량이라 가성비 좋게 쓰기 좋구요. 향도 무난하고 화장솜 묻혀 닦았을때 너무 가볍지도 무겁지도 않아 좋아요. 저는 개인적으로 콧물 제형같은 토너는 안좋아해서요.

수분진정용이라 아침 저녁으로 화장 전 후로 쓰기 좋을것 같단 생각이 드는 제품이었습니다.",5
냥냥펀츼,22,스킨/토너,"토너팩하는데 촉촉하고 좋아오 적당히 츅촉하고 ㅎㅎ 진정은 뮬
겟음",5
오동통통I,22,스킨/토너,어성초라인을 좋아하고 극건성이라 촉촉한 타입을 찾고 있어서 마침 용량도 좋고 1+1 이라 구매했는데 잘한 선택이었어요~! 용량이 많은 편이라 리필용하나 아직도 개봉안한 상태에용 ㅋㅋ,5
박서철,22,스킨/토너,속건조를 잘 잡아주네요! 만족하면서 사용 중입니당!!:)ㅔ,5
쿼카칭구,22,스킨/토너,끈적임 없이 물같은 산뜻한 제형이에요! 향도 거슬리지 않고 좋아요~,5
yoo****,22,스킨/토너,닦토로 사용중 입니다 순하고 촉촉합니다 모든피부에 사용하기 좋습니다,5
올리부엉,22,스킨/토너,"자극없이 순한 토너입니다. 유분감 전혀 없어서 확실히 여름에 쓰기 좋을 거 같아요.

다만 진정효과는 크게는 모르겠습니다. 열감 내려주기엔 좋아요.

물토너인데 수딩이란 이름이 들어간만큼 완전 물 느낌은 아니구요, 살짝 알로에젤 같은 느낌 5프로+물 95프로 느낌? 콧물까진 아니고 그렇다고 수분감 쫙 날아갈 것 같은 물도 아닙니다.

트러블이 요즘 계속 나고 있어서 서터레스였는데 다행히 이 토너 쓴다고 좁쌀 올라온다던가 하는 부작용은 없었구요, 다만 큰 진정효과는 못 봤어요.

그래도 토너면 이 정도면 충분하다 싶어 별점 4점 드립니다. 저처럼 수부지이신 분들 좁쌀 안 나는 무난한 토너 원하시면 구매 추천드리구요 토너 단계부터 진정 빡 들어가는 기능이 확실하면 좋겠다하심 비추입니다.

저는 팩토너로도 쓰고 흡수토너로도 쓰고 있어요. 일단 혜자로운 양에 여름에 맘 편히 쓰기 좋습니다.

결론?
무난한 가성비템 찾으면 추천.",4
sususu,22,스킨/토너,주르륵 흐르는 완전 물 같은 토너에요 그래서 그런지 끈적임없이 흡수가 굉장히 빨라서 좋아요 향도 괜찮고 바르면 매끈매끈 촉촉하고 좋네요 기초로 바르고 화장해도 밀리거나 들뜨지 않아서 마음에 들어요 리필도 있고 양도 많아서 한동안 잘 쓸 것 같아요,5
yjy****,22,스킨/토너,"각질 있는 수부지입니다
진정 보습 빠르게 되고, 화장솜에 적셔서 토너팩 하면 아침에 열감 감소, 진정, 보습까지 한번에 되는 제품이라 너무 잘 사용하고 있어요. 총 700ml라서 막 써도 양이 넘쳐나더라구요. 토너 손에 부어서 얼굴에 막 발라도 좋아요",5
kky****,22,스킨/토너,"수분앰플 짝궁템으로 샀습니다.
세안 후 시원한 수분충전템으로 딱이고요 어성초 토너 사용하면 트러블이 바로 났는데 이건 없네요. 스킨 찹찹 바를 때 열감 떨어뜨려서 좋아요.
여름에 이거 크림 사서 발라보고 싶네요. 화잘먹 템으로 좋습니당.",5
호노보노,22,스킨/토너,피부과 좋아졌어요!! 기름이 많았는데 줄어든 것 같습니다!,5
BloomingJ,22,스킨/토너,자극없고 순한 편인데 요즘같은 날씨에는 수분 채우기가 살짝 부족한 감이 있어요~ 레이어링 해줌 되지만요,5
wmf0****,22,스킨/토너,사용감이 맹물보다는 농도가 있는 느낌에 토너이고 여름보다는 지금이 쓰기 좋아요,4
Voicemail,22,스킨/토너,원래도 토너는 수분만 채워주는 용도로만 썼어서 그냥저냥 만족 했스비낟 엄청나게 진정 된다 이런건 못느꼈어요,5
사이시옷,22,스킨/토너,"기존 구달의 어성초 토너도 써보고 참 좋았었는데
이번에 새로 리뉴얼된 제품도 굉장히 맘에 드네요!
약간 쑥색 느낌의 용기가 연한 하늘색으로 바뀌어서 산뜻하고
히알루론이 더해져 진정효과에 보습이 더 강해진 듯 합니다.
향도 어성초향이 은은한 편이고 가벼운 물토너라서
닦토나 피부결 정돈하는 용으로도 쓰기 좋은것 같고
흡수된 후에도 촉촉하니 보습력이 좋아서 만족스러워요^^",5
꽉꽉잉,22,스킨/토너,"✅ 제형감 & 사용감
➖물처럼 주르륵 흐르는 물 제형의 토너예요. 화장솜에 토너 듬뿍 묻혀서 얼굴에 잠시 올려놨다가 가볍게 쓱 닦아내면 피부결도 부들부들 너무 좋아져요. 그리고 11종의 히알루론산 성분 덕분에 피부 속까지 수분 충전을 해줘서 화장도 평소보다 더 잘 먹는 것 같아요. 처음에 발랐을 때는 좀 끈적끈적한가 싶었는데 조금 있으니까 흡수되면서 겉은 산뜻한데 속은 수분 충전돼서 살짝 시원하고 피부가 촉촉말랑해진 느낌이 들었어요. 게다가 괴물 용량이라 엄청 오래 쓸 수 있을 것 같아요

✅ 진정 & 자극감
➖저는 원래 각질이 두껍거나 많이 쌓이는 편이 아니라 잔 각질이 아주 조금 있는 편이고, 특히 볼 부분이 정말 초초초민감한 편이에요. 그래서 아침에 한 번 쓸 때는 괜찮았는데 저녁에도 쓰니까 볼 부분이 살짝 자극받은 것 같은 느낌이 들었어요. 근데 피부가 뒤집힐 정도로 자극적이진 않았고 살짝 붉어진 정도였고 초민감한 볼 부분만 그랬어요. 그래서 저는 주기를 정해서 일주일에 한 번이나 두 번 정도 각질때문에 피부가 너무 너무 거칠한 것 같다 싶을 때 써주고 있어요. 어성초나 히알루론산, 판테놀 저랑 다 잘 맞는 성분인데 아무래도 각질제거 성분 때문에 그렇지 않을까라는 생각이 드네요. 안 그래도 얼굴에 각질이 많이 없는데 토너 바를 때마다 각질 제거가 되니까 자극이 된 건지… 요즘 대부분의 토너에 각질 제거 성분이 들어가 있어서 안 들어간 제품을 찾기가 힘들더라구요… 민감성 피부를 위해서 각질 제거 성분 안 들어간 토너 따로 만들어주실 수 없나요..구달 담당자님??🥹 지금 이 토너 성분이며 사용감 다 너무 좋은데 각질 제거 성분만 안 들어갔으면 진짜 매일 휘뚜루마뚜루 쓸 수 있을 것 같아요.

➖이 토너는 수분 충전에 초점을 두는 게 좋을 것 같아요. 이 토너 하나만으로는 확 진정되긴 어려운 것 같고, 수분 충전을 잘 해줘서 수분 장벽을 탄탄하게 해주는 걸로 피부를 서서히 건강하게 만들어주는 느낌이 저는 들었어요.",4
